# Loading a Facebook Newsfeed page
00:00:00.000000 IP client > server: tcp 0
00:00:00.001488 IP server > client: tcp 0
00:00:00.000035 IP client > server: tcp 0
00:00:00.000176 IP client > server: tcp 1246
00:00:00.101439 IP server > client: tcp 0
00:00:00.059242 IP server > client: tcp 1448
00:00:00.000004 IP server > client: tcp 1448
00:00:00.000004 IP server > client: tcp 170
00:00:00.000064 IP client > server: tcp 0
00:00:00.000019 IP client > server: tcp 0
00:00:00.000013 IP client > server: tcp 0
00:00:00.610617 IP client > server: tcp 1335
00:00:00.063694 IP server > client: tcp 1011
00:00:00.000070 IP client > server: tcp 0
00:00:00.372150 IP server > client: tcp 1448
00:00:00.000050 IP client > server: tcp 0
00:00:00.000133 IP server > client: tcp 1448
00:00:00.000003 IP server > client: tcp 1448
00:00:00.000037 IP client > server: tcp 0
00:00:00.000012 IP client > server: tcp 0
00:00:00.000146 IP server > client: tcp 1448
00:00:00.000032 IP client > server: tcp 0
00:00:00.000928 IP server > client: tcp 1448
00:00:00.000197 IP client > server: tcp 0
00:00:00.001384 IP server > client: tcp 91
00:00:00.000026 IP client > server: tcp 0
00:00:00.001245 IP server > client: tcp 458
00:00:00.000020 IP client > server: tcp 0
00:00:00.004900 IP server > client: tcp 516
00:00:00.000067 IP client > server: tcp 0
00:00:00.002553 IP server > client: tcp 416
00:00:00.000022 IP client > server: tcp 0
00:00:00.022366 IP server > client: tcp 1448
00:00:00.000004 IP server > client: tcp 1448
00:00:00.000047 IP client > server: tcp 0
00:00:00.000011 IP client > server: tcp 0
00:00:00.001225 IP server > client: tcp 350
00:00:00.000013 IP client > server: tcp 0
00:00:00.333124 IP server > client: tcp 1448
00:00:00.000005 IP server > client: tcp 1448
00:00:00.000002 IP server > client: tcp 1448
00:00:00.000004 IP server > client: tcp 1448
00:00:00.000003 IP server > client: tcp 1448
00:00:00.000066 IP client > server: tcp 0
00:00:00.000011 IP client > server: tcp 0
00:00:00.000003 IP server > client: tcp 1448
00:00:00.000002 IP client > server: tcp 0
00:00:00.000004 IP client > server: tcp 0
00:00:00.000007 IP client > server: tcp 0
00:00:00.000041 IP client > server: tcp 0
00:00:00.001230 IP server > client: tcp 212
00:00:00.000022 IP client > server: tcp 0
00:00:00.009733 IP server > client: tcp 1323
00:00:00.000029 IP client > server: tcp 0
00:00:00.054125 IP server > client: tcp 1448
00:00:00.000003 IP server > client: tcp 1448
00:00:00.000002 IP server > client: tcp 1448
00:00:00.000033 IP client > server: tcp 0
00:00:00.000011 IP client > server: tcp 0
00:00:00.000006 IP client > server: tcp 0
00:00:00.001425 IP server > client: tcp 238
00:00:00.000017 IP client > server: tcp 0
00:00:00.022418 IP server > client: tcp 1448
00:00:00.000003 IP server > client: tcp 1448
00:00:00.000036 IP client > server: tcp 0
00:00:00.000010 IP client > server: tcp 0
00:00:00.001217 IP server > client: tcp 140
00:00:00.000026 IP client > server: tcp 0
00:00:00.026392 IP server > client: tcp 521
00:00:00.000030 IP client > server: tcp 0
00:00:00.059137 IP server > client: tcp 618
00:00:00.000043 IP client > server: tcp 0
00:00:00.003838 IP server > client: tcp 414
00:00:00.000034 IP client > server: tcp 0
00:00:00.009287 IP server > client: tcp 1350
00:00:00.000026 IP client > server: tcp 0
00:00:00.206256 IP server > client: tcp 1448
00:00:00.000042 IP client > server: tcp 0
00:00:00.001343 IP server > client: tcp 1100
00:00:00.000058 IP client > server: tcp 0
00:00:00.023549 IP server > client: tcp 113
00:00:00.000037 IP client > server: tcp 0
00:00:00.001388 IP server > client: tcp 92
00:00:00.000014 IP client > server: tcp 0
00:00:00.035775 IP server > client: tcp 1448
00:00:00.000003 IP server > client: tcp 1448
00:00:00.000002 IP server > client: tcp 1448
00:00:00.000040 IP client > server: tcp 0
00:00:00.000012 IP client > server: tcp 0
00:00:00.000006 IP client > server: tcp 0
00:00:00.001471 IP server > client: tcp 626
00:00:00.000025 IP client > server: tcp 0
00:00:00.056270 IP server > client: tcp 1448
00:00:00.000023 IP client > server: tcp 0
00:00:00.001359 IP server > client: tcp 973
00:00:00.000019 IP client > server: tcp 0
00:00:00.303474 IP server > client: tcp 1448
00:00:00.000004 IP server > client: tcp 1448
00:00:00.000003 IP server > client: tcp 1448
00:00:00.000004 IP server > client: tcp 1448
00:00:00.000047 IP client > server: tcp 0
00:00:00.000017 IP client > server: tcp 0
00:00:00.000006 IP client > server: tcp 0
00:00:00.000005 IP client > server: tcp 0
00:00:00.001375 IP server > client: tcp 1178
00:00:00.000036 IP client > server: tcp 0
00:00:00.019561 IP server > client: tcp 1448
00:00:00.000040 IP client > server: tcp 0
00:00:00.001338 IP server > client: tcp 216
00:00:00.000047 IP client > server: tcp 0
00:00:00.000154 IP server > client: tcp 43
00:00:00.000010 IP client > server: tcp 0
00:00:00.926567 IP client > server: tcp 1245
00:00:00.042440 IP server > client: tcp 825
00:00:00.000052 IP client > server: tcp 0
00:00:00.072165 IP client > server: tcp 1314
00:00:00.000016 IP client > server: tcp 2863
00:00:00.003419 IP server > client: tcp 0
00:00:00.061985 IP server > client: tcp 1448
00:00:00.000003 IP server > client: tcp 626
00:00:00.000015 IP client > server: tcp 0
00:00:00.000009 IP client > server: tcp 0