00:00:00.000000 IP client > server: tcp 0
00:00:00.059851 IP server > client: tcp 0
00:00:00.000074 IP client > server: tcp 0
00:00:00.000455 IP client > server: tcp 594
00:00:00.061363 IP server > client: tcp 0
00:00:00.020636 IP server > client: tcp 1448
00:00:00.001745 IP server > client: tcp 1448
00:00:00.000034 IP client > server: tcp 0
00:00:00.002112 IP server > client: tcp 1448
00:00:00.062564 IP server > client: tcp 1448
00:00:00.000068 IP client > server: tcp 0
00:00:00.000592 IP server > client: tcp 1448
00:00:00.000280 IP server > client: tcp 1448
00:00:00.000025 IP client > server: tcp 0
00:00:00.054451 IP server > client: tcp 1448
00:00:00.001995 IP server > client: tcp 1448
00:00:00.000084 IP client > server: tcp 0
00:00:00.003692 IP server > client: tcp 1448
00:00:00.002339 IP server > client: tcp 1448
00:00:00.000082 IP client > server: tcp 0
00:00:00.002837 IP server > client: tcp 1448
00:00:00.002880 IP server > client: tcp 1448
00:00:00.000089 IP client > server: tcp 0
00:00:00.046024 IP server > client: tcp 1448
00:00:00.001975 IP server > client: tcp 1448
00:00:00.000806 IP client > server: tcp 0
00:00:00.003343 IP server > client: tcp 1448
00:00:00.000035 IP client > server: tcp 0
00:00:00.000636 IP server > client: tcp 1448
00:00:00.001494 IP server > client: tcp 1448
00:00:00.000063 IP client > server: tcp 0
00:00:00.003723 IP server > client: tcp 1448
00:00:00.001922 IP server > client: tcp 1448
00:00:00.001300 IP client > server: tcp 0
00:00:00.002089 IP server > client: tcp 1448
00:00:00.000915 IP server > client: tcp 1448
00:00:00.020076 IP client > server: tcp 0
00:00:00.025517 IP server > client: tcp 1448
00:00:00.000356 IP server > client: tcp 1448
00:00:00.000544 IP client > server: tcp 0
00:00:00.001399 IP server > client: tcp 1448
00:00:00.000028 IP client > server: tcp 0
00:00:00.001619 IP server > client: tcp 1448
00:00:00.004768 IP server > client: tcp 1448
00:00:00.000156 IP client > server: tcp 0
00:00:00.001477 IP server > client: tcp 1448
00:00:00.001607 IP server > client: tcp 1448
00:00:00.002195 IP server > client: tcp 1448
00:00:00.001873 IP server > client: tcp 1448
00:00:00.000114 IP client > server: tcp 0
00:00:00.003381 IP server > client: tcp 1448
00:00:00.002558 IP server > client: tcp 1448
00:00:00.000090 IP client > server: tcp 0
00:00:00.033938 IP server > client: tcp 1448
00:00:00.000062 IP client > server: tcp 0
00:00:00.001814 IP server > client: tcp 1448
00:00:00.002200 IP server > client: tcp 1448
00:00:00.000182 IP client > server: tcp 0
00:00:00.001603 IP server > client: tcp 1448
00:00:00.004041 IP server > client: tcp 1448
00:00:00.000085 IP client > server: tcp 0
00:00:00.001953 IP server > client: tcp 1448
00:00:00.002945 IP server > client: tcp 1448
00:00:00.000071 IP client > server: tcp 0
00:00:00.005213 IP server > client: tcp 1448
00:00:00.000051 IP server > client: tcp 1448
00:00:00.000298 IP server > client: tcp 1448
00:00:00.001412 IP client > server: tcp 0
00:00:00.002364 IP server > client: tcp 1448
00:00:00.001580 IP server > client: tcp 1448
00:00:00.002131 IP server > client: tcp 1448
00:00:00.001972 IP client > server: tcp 0
00:00:00.000380 IP server > client: tcp 1448
00:00:00.001398 IP server > client: tcp 1448
00:00:00.002174 IP server > client: tcp 1448
00:00:00.002869 IP client > server: tcp 0
00:00:00.019230 IP server > client: tcp 1448
00:00:00.001839 IP server > client: tcp 1448
00:00:00.002134 IP server > client: tcp 1448
00:00:00.000044 IP client > server: tcp 0
00:00:00.004779 IP server > client: tcp 1448
00:00:00.000904 IP client > server: tcp 0
00:00:00.006460 IP server > client: tcp 1448
00:00:00.000203 IP server > client: tcp 1448
00:00:00.000214 IP client > server: tcp 0
00:00:00.000084 IP server > client: tcp 1448
00:00:00.002255 IP server > client: tcp 1448
00:00:00.000156 IP client > server: tcp 0
00:00:00.001940 IP server > client: tcp 1448
00:00:00.000197 IP server > client: tcp 1448
00:00:00.000085 IP client > server: tcp 0
00:00:00.000630 IP server > client: tcp 1448
00:00:00.004125 IP server > client: tcp 1448
00:00:00.000057 IP client > server: tcp 0
00:00:00.002277 IP server > client: tcp 1448
00:00:00.001880 IP server > client: tcp 1448
00:00:00.000190 IP client > server: tcp 0
00:00:00.001810 IP server > client: tcp 1448
00:00:00.002119 IP server > client: tcp 1448
00:00:00.001428 IP server > client: tcp 1448
00:00:00.000681 IP client > server: tcp 0
00:00:00.004169 IP server > client: tcp 1448
00:00:00.001160 IP server > client: tcp 1448
00:00:00.000049 IP client > server: tcp 0
00:00:00.002002 IP server > client: tcp 1448
00:00:00.002204 IP server > client: tcp 1448
00:00:00.000018 IP client > server: tcp 0
00:00:00.001662 IP server > client: tcp 1448
00:00:00.014396 IP server > client: tcp 1448
00:00:00.000131 IP client > server: tcp 0
00:00:00.000260 IP server > client: tcp 1448
00:00:00.003287 IP server > client: tcp 1448
00:00:00.000173 IP client > server: tcp 0
00:00:00.002067 IP server > client: tcp 1448
00:00:00.001786 IP server > client: tcp 1448
00:00:00.000347 IP client > server: tcp 0
00:00:00.001624 IP server > client: tcp 1448
00:00:00.002242 IP server > client: tcp 1448
00:00:00.000161 IP client > server: tcp 0
00:00:00.001688 IP server > client: tcp 1448
00:00:00.000066 IP client > server: tcp 0
00:00:00.005114 IP server > client: tcp 1448
00:00:00.000296 IP server > client: tcp 1448
00:00:00.000055 IP client > server: tcp 0
00:00:00.002558 IP server > client: tcp 1448
00:00:00.002007 IP server > client: tcp 1448
00:00:00.000560 IP client > server: tcp 0
00:00:00.001365 IP server > client: tcp 1448
00:00:00.001951 IP server > client: tcp 1448
00:00:00.000127 IP client > server: tcp 0
00:00:00.001787 IP server > client: tcp 1448
00:00:00.002178 IP server > client: tcp 1448
00:00:00.000089 IP client > server: tcp 0
00:00:00.001732 IP server > client: tcp 1448
00:00:00.000016 IP client > server: tcp 0
00:00:00.004255 IP server > client: tcp 1448
00:00:00.001904 IP server > client: tcp 1448
00:00:00.000704 IP client > server: tcp 0
00:00:00.002131 IP server > client: tcp 1448
00:00:00.001081 IP server > client: tcp 1448
00:00:00.000043 IP client > server: tcp 0
00:00:00.002029 IP server > client: tcp 1448
00:00:00.004283 IP server > client: tcp 1448
00:00:00.000100 IP client > server: tcp 0
00:00:00.001503 IP server > client: tcp 1448
00:00:00.001845 IP server > client: tcp 1448
00:00:00.000046 IP client > server: tcp 0
00:00:00.002229 IP server > client: tcp 1448
00:00:00.000032 IP client > server: tcp 0
00:00:00.002020 IP server > client: tcp 1448
00:00:00.001806 IP server > client: tcp 1448
00:00:00.002595 IP server > client: tcp 1448
00:00:00.002448 IP server > client: tcp 1448
00:00:00.000943 IP server > client: tcp 1448
00:00:00.002645 IP client > server: tcp 0
00:00:00.001762 IP server > client: tcp 1448
00:00:00.000540 IP server > client: tcp 1448
00:00:00.000094 IP client > server: tcp 0
00:00:00.003092 IP server > client: tcp 1448
00:00:00.002903 IP server > client: tcp 1448
00:00:00.000051 IP client > server: tcp 0
00:00:00.001416 IP server > client: tcp 1448
00:00:00.003783 IP server > client: tcp 1448
00:00:00.000164 IP client > server: tcp 0
00:00:00.000252 IP server > client: tcp 1448
00:00:00.001412 IP server > client: tcp 1448
00:00:00.000064 IP client > server: tcp 0
00:00:00.004072 IP server > client: tcp 1448
00:00:00.001142 IP server > client: tcp 1448
00:00:00.000535 IP client > server: tcp 0
00:00:00.002193 IP server > client: tcp 1448
00:00:00.002049 IP server > client: tcp 1448
00:00:00.000050 IP client > server: tcp 0
00:00:00.001778 IP server > client: tcp 1448
00:00:00.000015 IP client > server: tcp 0
00:00:00.002166 IP server > client: tcp 1448
00:00:00.001965 IP server > client: tcp 1448
00:00:00.000052 IP client > server: tcp 0
00:00:00.002110 IP server > client: tcp 1448
00:00:00.005792 IP server > client: tcp 1448
00:00:00.000514 IP client > server: tcp 0
00:00:00.000195 IP server > client: tcp 1448
00:00:00.001390 IP server > client: tcp 1448
00:00:00.001786 IP server > client: tcp 1448
00:00:00.000168 IP client > server: tcp 0
00:00:00.002074 IP server > client: tcp 1448
00:00:00.001907 IP server > client: tcp 1448
00:00:00.000020 IP client > server: tcp 0
00:00:00.004078 IP server > client: tcp 1448
00:00:00.000414 IP server > client: tcp 1448
00:00:00.000741 IP client > server: tcp 0
00:00:00.000987 IP server > client: tcp 1448
00:00:00.003793 IP server > client: tcp 1448
00:00:00.001946 IP server > client: tcp 1448
00:00:00.001959 IP server > client: tcp 1448
00:00:00.001844 IP client > server: tcp 0
00:00:00.000042 IP server > client: tcp 1448
00:00:00.002161 IP server > client: tcp 1448
00:00:00.001838 IP client > server: tcp 0
00:00:00.000132 IP server > client: tcp 1448
00:00:00.000019 IP client > server: tcp 0
00:00:00.004135 IP server > client: tcp 1448
00:00:00.000505 IP server > client: tcp 1448
00:00:00.000136 IP client > server: tcp 0
00:00:00.003133 IP server > client: tcp 1448
00:00:00.002594 IP server > client: tcp 1448
00:00:00.001385 IP server > client: tcp 1448
00:00:00.005344 IP server > client: tcp 1448
00:00:00.000229 IP server > client: tcp 1448
00:00:00.000454 IP server > client: tcp 1448
00:00:00.004148 IP server > client: tcp 1448
00:00:00.000043 IP client > server: tcp 0
00:00:00.001708 IP server > client: tcp 1448
00:00:00.000117 IP client > server: tcp 0
00:00:00.001876 IP server > client: tcp 1448
00:00:00.002249 IP server > client: tcp 1448
00:00:00.000505 IP client > server: tcp 0
00:00:00.001359 IP server > client: tcp 1448
00:00:00.002052 IP server > client: tcp 1448
00:00:00.000125 IP client > server: tcp 0
00:00:00.004362 IP server > client: tcp 1448
00:00:00.000290 IP server > client: tcp 1448
00:00:00.001092 IP server > client: tcp 1448
00:00:00.000008 IP client > server: tcp 0
00:00:00.004260 IP server > client: tcp 1448
00:00:00.000034 IP client > server: tcp 0
00:00:00.001656 IP server > client: tcp 1448
00:00:00.004163 IP server > client: tcp 1448
00:00:00.000109 IP client > server: tcp 0
00:00:00.000881 IP server > client: tcp 1448
00:00:00.001562 IP server > client: tcp 1448
00:00:00.000044 IP client > server: tcp 0
00:00:00.003525 IP server > client: tcp 1448
00:00:00.000724 IP server > client: tcp 1448
00:00:00.000130 IP client > server: tcp 0
00:00:00.000915 IP server > client: tcp 1448
00:00:00.004201 IP server > client: tcp 1448
00:00:00.000093 IP client > server: tcp 0
00:00:00.001708 IP server > client: tcp 1448
00:00:00.000024 IP client > server: tcp 0
00:00:00.002129 IP server > client: tcp 1448
00:00:00.002039 IP server > client: tcp 1448
00:00:00.001544 IP client > server: tcp 0
00:00:00.000254 IP server > client: tcp 1448
00:00:00.004262 IP server > client: tcp 1448
00:00:00.000169 IP client > server: tcp 0
00:00:00.002277 IP server > client: tcp 1448
00:00:00.001652 IP server > client: tcp 1448
00:00:00.000250 IP client > server: tcp 0
00:00:00.001371 IP server > client: tcp 1448
00:00:00.002443 IP server > client: tcp 1448
00:00:00.000104 IP client > server: tcp 0
00:00:00.001465 IP server > client: tcp 1448
00:00:00.000033 IP client > server: tcp 0
00:00:00.004225 IP server > client: tcp 1448
00:00:00.000467 IP server > client: tcp 1448
00:00:00.000087 IP client > server: tcp 0
00:00:00.001428 IP server > client: tcp 1448
00:00:00.004025 IP server > client: tcp 1448
00:00:00.000214 IP client > server: tcp 0
00:00:00.001509 IP server > client: tcp 1448
00:00:00.002780 IP server > client: tcp 1448
00:00:00.000122 IP client > server: tcp 0
00:00:00.001412 IP server > client: tcp 1448
00:00:00.002798 IP server > client: tcp 1448
00:00:00.000136 IP client > server: tcp 0
00:00:00.001940 IP server > client: tcp 1448
00:00:00.000039 IP client > server: tcp 0
00:00:00.000850 IP server > client: tcp 1448
00:00:00.002109 IP server > client: tcp 1448
00:00:00.000740 IP client > server: tcp 0
00:00:00.001603 IP server > client: tcp 1448
00:00:00.003779 IP server > client: tcp 1448
00:00:00.000111 IP client > server: tcp 0
00:00:00.003234 IP server > client: tcp 1448
00:00:00.012819 IP server > client: tcp 1448
00:00:00.000145 IP server > client: tcp 1448
00:00:00.000179 IP client > server: tcp 0
00:00:00.000116 IP server > client: tcp 1448
00:00:00.001110 IP server > client: tcp 1448
00:00:00.000004 IP server > client: tcp 1448
00:00:00.000001 IP server > client: tcp 1448
00:00:00.000021 IP client > server: tcp 0
00:00:00.000124 IP server > client: tcp 1448
00:00:00.001830 IP server > client: tcp 1448
00:00:00.001683 IP client > server: tcp 0
00:00:00.003128 IP server > client: tcp 1448
00:00:00.000006 IP server > client: tcp 1448
00:00:00.000250 IP client > server: tcp 0
00:00:00.001346 IP server > client: tcp 1448
00:00:00.001624 IP server > client: tcp 1448
00:00:00.000053 IP client > server: tcp 0
00:00:00.002119 IP server > client: tcp 1448
00:00:00.000033 IP client > server: tcp 0
00:00:00.004021 IP server > client: tcp 1448
00:00:00.006376 IP server > client: tcp 1448
00:00:00.000140 IP server > client: tcp 1448
00:00:00.000309 IP server > client: tcp 1443
00:00:00.000028 IP client > server: tcp 0
