# Facebook News Feed, over 3G connection @8X
1283449103.742932 IP client > dns: 59121+ A? www.facebook.com. (34)
1283449103.752888 IP client > dns: 38565+ AAAA? www.facebook.com. (34)
1283449103.830272 IP dns > client: 38565 0/1/0 (101)
1283449103.831667 IP dns > client: 59121 1/4/4 A 66.220.153.11 (223)
1283449103.832338 IP client > www.facebook: Flags [S], seq 875995199, win 65535, options [mss 1460,nop,wscale 3,nop,nop,TS val 424662549 ecr 0,sackOK,eol], length 0
1283449104.020340 IP www.facebook > client: Flags [S.], seq 758905567, ack 875995200, win 4380, options [mss 1460,nop,wscale 0,nop,nop,TS val 3548950849 ecr 424662549,sackOK,eol], length 0
1283449104.020465 IP client > www.facebook: Flags [.], ack 1, win 65535, options [nop,nop,TS val 424662551 ecr 3548950849], length 0
1283449104.020721 IP client > www.facebook: Flags [P.], seq 1:1117, ack 1, win 65535, options [nop,nop,TS val 424662551 ecr 3548950849], length 1116
1283449104.378748 IP www.facebook > client: Flags [P.], seq 1:1173, ack 1117, win 5496, options [nop,nop,TS val 3548951211 ecr 424662551], length 1172
1283449104.378835 IP client > www.facebook: Flags [.], ack 1173, win 65535, options [nop,nop,TS val 424662555 ecr 3548951211], length 0
1283449104.395538 IP client > dns: 7854+ A? static.ak.fbcdn.net. (37)
1283449104.405924 IP client > dns: 56864+ AAAA? static.ak.fbcdn.net. (37)
1283449104.490500 IP www.facebook > client: Flags [P.], seq 1173:2621, ack 1117, win 5496, options [nop,nop,TS val 3548951327 ecr 424662551], length 1448
1283449104.490558 IP client > www.facebook: Flags [.], ack 2621, win 65522, options [nop,nop,TS val 424662556 ecr 3548951327], length 0
1283449104.499098 IP www.facebook > client: Flags [P.], seq 2621:4069, ack 1117, win 5496, options [nop,nop,TS val 3548951327 ecr 424662551], length 1448
1283449104.499132 IP client > www.facebook: Flags [.], ack 4069, win 65522, options [nop,nop,TS val 424662556 ecr 3548951327], length 0
1283449104.508204 IP dns > client: 7854 4/9/9 CNAME static.ak.facebook.com.edgesuite.net., CNAME a749.g.akamai.net., A 65.171.167.136, A 65.171.167.123 (450)
1283449104.513735 IP dns > client: 56864 2/1/0 CNAME static.ak.facebook.com.edgesuite.net., CNAME a749.g.akamai.net. (173)
1283449104.540893 IP www.facebook > client: Flags [.], seq 4069:5517, ack 1117, win 5496, options [nop,nop,TS val 3548951376 ecr 424662555], length 1448
1283449104.622685 IP client > static.akamai: Flags [S], seq 3870379584, win 65535, options [mss 1460,nop,wscale 3,nop,nop,TS val 424662557 ecr 0,sackOK,eol], length 0
1283449104.622818 IP client > static.akamai: Flags [S], seq 1044397634, win 65535, options [mss 1460,nop,wscale 3,nop,nop,TS val 424662557 ecr 0,sackOK,eol], length 0
1283449104.622905 IP client > static.akamai: Flags [S], seq 2123289141, win 65535, options [mss 1460,nop,wscale 3,nop,nop,TS val 424662557 ecr 0,sackOK,eol], length 0
1283449104.622982 IP client > static.akamai: Flags [S], seq 1573497609, win 65535, options [mss 1460,nop,wscale 3,nop,nop,TS val 424662557 ecr 0,sackOK,eol], length 0
1283449104.623079 IP client > static.akamai: Flags [S], seq 2066738158, win 65535, options [mss 1460,nop,wscale 3,nop,nop,TS val 424662557 ecr 0,sackOK,eol], length 0
1283449104.623133 IP client > static.akamai: Flags [S], seq 899875681, win 65535, options [mss 1460,nop,wscale 3,nop,nop,TS val 424662557 ecr 0,sackOK,eol], length 0
1283449104.627364 IP www.facebook > client: Flags [.], seq 5517:6965, ack 1117, win 5496, options [nop,nop,TS val 3548951462 ecr 424662556], length 1448
1283449104.627396 IP client > www.facebook: Flags [.], ack 6965, win 65522, options [nop,nop,TS val 424662557 ecr 3548951376], length 0
1283449104.632576 IP www.facebook > client: Flags [.], seq 6965:8413, ack 1117, win 5496, options [nop,nop,TS val 3548951462 ecr 424662556], length 1448
1283449104.660952 IP client > www.facebook: Flags [.], ack 8413, win 65535, options [nop,nop,TS val 424662557 ecr 3548951462], length 0
1283449104.680020 IP www.facebook > client: Flags [.], seq 8413:9861, ack 1117, win 5496, options [nop,nop,TS val 3548951516 ecr 424662556], length 1448
1283449104.693569 IP www.facebook > client: Flags [.], seq 9861:11309, ack 1117, win 5496, options [nop,nop,TS val 3548951516 ecr 424662556], length 1448
1283449104.693613 IP client > www.facebook: Flags [.], ack 11309, win 65522, options [nop,nop,TS val 424662558 ecr 3548951516], length 0
1283449104.744689 IP static.akamai > client: Flags [S.], seq 2912895908, ack 3870379585, win 5792, options [mss 1460,sackOK,TS val 1322162117 ecr 424662557,nop,wscale 5], length 0
1283449104.744729 IP client > static.akamai: Flags [.], ack 1, win 65535, options [nop,nop,TS val 424662558 ecr 1322162117], length 0
1283449104.744857 IP client > static.akamai: Flags [P.], seq 1:403, ack 1, win 65535, options [nop,nop,TS val 424662558 ecr 1322162117], length 402
1283449104.745752 IP static.akamai > client: Flags [S.], seq 2910289464, ack 1044397635, win 5792, options [mss 1460,sackOK,TS val 1322162117 ecr 424662557,nop,wscale 5], length 0
1283449104.745768 IP static.akamai > client: Flags [S.], seq 2906492357, ack 2123289142, win 5792, options [mss 1460,sackOK,TS val 1322162126 ecr 424662557,nop,wscale 5], length 0
1283449104.745770 IP client > static.akamai: Flags [.], ack 1, win 65535, options [nop,nop,TS val 424662558 ecr 1322162117], length 0
1283449104.745779 IP client > static.akamai: Flags [.], ack 1, win 65535, options [nop,nop,TS val 424662558 ecr 1322162126], length 0
1283449104.745847 IP client > static.akamai: Flags [P.], seq 1:403, ack 1, win 65535, options [nop,nop,TS val 424662558 ecr 1322162117], length 402
1283449104.745863 IP client > static.akamai: Flags [P.], seq 1:403, ack 1, win 65535, options [nop,nop,TS val 424662558 ecr 1322162126], length 402
1283449104.771609 IP static.akamai > client: Flags [S.], seq 2906923802, ack 1573497610, win 5792, options [mss 1460,sackOK,TS val 1322162126 ecr 424662557,nop,wscale 5], length 0
1283449104.771647 IP client > static.akamai: Flags [.], ack 1, win 65535, options [nop,nop,TS val 424662559 ecr 1322162126], length 0
1283449104.771756 IP client > static.akamai: Flags [P.], seq 1:403, ack 1, win 65535, options [nop,nop,TS val 424662559 ecr 1322162126], length 402
1283449104.773063 IP static.akamai > client: Flags [S.], seq 2906024227, ack 2066738159, win 5792, options [mss 1460,sackOK,TS val 1322162126 ecr 424662557,nop,wscale 5], length 0
1283449104.773079 IP client > static.akamai: Flags [.], ack 1, win 65535, options [nop,nop,TS val 424662559 ecr 1322162126], length 0
1283449104.773088 IP static.akamai > client: Flags [S.], seq 2899516981, ack 899875682, win 5792, options [mss 1460,sackOK,TS val 1322162126 ecr 424662557,nop,wscale 5], length 0
1283449104.773090 IP static.akamai > client: Flags [S.], seq 2910289464, ack 1044397635, win 5792, options [mss 1460,sackOK,TS val 1322162131 ecr 424662557,nop,wscale 5], length 0
1283449104.773100 IP client > static.akamai: Flags [.], ack 1, win 65535, options [nop,nop,TS val 424662559 ecr 1322162126], length 0
1283449104.773107 IP client > static.akamai: Flags [.], ack 1, win 65535, options [nop,nop,TS val 424662559 ecr 1322162131], length 0
1283449104.773148 IP client > static.akamai: Flags [P.], seq 1:403, ack 1, win 65535, options [nop,nop,TS val 424662559 ecr 1322162126], length 402
1283449104.773188 IP client > static.akamai: Flags [P.], seq 1:403, ack 1, win 65535, options [nop,nop,TS val 424662559 ecr 1322162126], length 402
1283449104.808446 IP www.facebook > client: Flags [.], seq 11309:12757, ack 1117, win 5496, options [nop,nop,TS val 3548951645 ecr 424662557], length 1448
1283449104.816397 IP www.facebook > client: Flags [.], seq 12757:14205, ack 1117, win 5496, options [nop,nop,TS val 3548951645 ecr 424662557], length 1448
1283449104.816498 IP client > www.facebook: Flags [.], ack 14205, win 65535, options [nop,nop,TS val 424662559 ecr 3548951645], length 0
1283449104.843112 IP www.facebook > client: Flags [.], seq 14205:15653, ack 1117, win 5496, options [nop,nop,TS val 3548951645 ecr 424662557], length 1448
1283449104.846429 IP www.facebook > client: Flags [.], seq 15653:17101, ack 1117, win 5496, options [nop,nop,TS val 3548951645 ecr 424662557], length 1448
1283449104.846501 IP client > www.facebook: Flags [.], ack 17101, win 65535, options [nop,nop,TS val 424662559 ecr 3548951645], length 0
1283449104.852704 IP www.facebook > client: Flags [.], seq 17101:18549, ack 1117, win 5496, options [nop,nop,TS val 3548951650 ecr 424662557], length 1448
1283449104.856532 IP www.facebook > client: Flags [.], seq 18549:19997, ack 1117, win 5496, options [nop,nop,TS val 3548951650 ecr 424662557], length 1448
1283449104.856604 IP client > www.facebook: Flags [.], ack 19997, win 65535, options [nop,nop,TS val 424662559 ecr 3548951650], length 0
1283449104.857672 IP static.akamai > client: Flags [.], ack 403, win 215, options [nop,nop,TS val 1322162231 ecr 424662558], length 0
1283449104.864191 IP static.akamai > client: Flags [.], seq 1:1449, ack 403, win 215, options [nop,nop,TS val 1322162232 ecr 424662558], length 1448
1283449104.864726 IP static.akamai > client: Flags [P.], seq 4345:4680, ack 403, win 215, options [nop,nop,TS val 1322162232 ecr 424662558], length 335
1283449104.864748 IP client > static.akamai: Flags [.], ack 1449, win 65535, options [nop,nop,TS val 424662560 ecr 1322162232,nop,nop,sack 1 {4345:4680}], length 0
1283449104.875264 IP static.akamai > client: Flags [.], seq 1449:2897, ack 403, win 215, options [nop,nop,TS val 1322162232 ecr 424662558], length 1448
1283449104.875332 IP client > static.akamai: Flags [.], ack 2897, win 65522, options [nop,nop,TS val 424662560 ecr 1322162232,nop,nop,sack 1 {4345:4680}], length 0
1283449104.885522 IP static.akamai > client: Flags [.], seq 2897:4345, ack 403, win 215, options [nop,nop,TS val 1322162232 ecr 424662558], length 1448
1283449104.885573 IP client > static.akamai: Flags [.], ack 4680, win 65480, options [nop,nop,TS val 424662560 ecr 1322162232], length 0
1283449104.885718 IP client > static.akamai: Flags [P.], seq 403:805, ack 4680, win 65535, options [nop,nop,TS val 424662560 ecr 1322162232], length 402
1283449104.895642 IP www.facebook > client: Flags [.], seq 19997:21445, ack 1117, win 5496, options [nop,nop,TS val 3548951728 ecr 424662558], length 1448
1283449104.903706 IP www.facebook > client: Flags [.], seq 21445:22893, ack 1117, win 5496, options [nop,nop,TS val 3548951728 ecr 424662558], length 1448
1283449104.903817 IP client > www.facebook: Flags [.], ack 22893, win 65535, options [nop,nop,TS val 424662560 ecr 3548951728], length 0
1283449104.911012 IP www.facebook > client: Flags [.], seq 22893:24341, ack 1117, win 5496, options [nop,nop,TS val 3548951728 ecr 424662558], length 1448
1283449104.911062 IP client > www.facebook: Flags [.], ack 24341, win 65522, options [nop,nop,TS val 424662560 ecr 3548951728], length 0
1283449104.941371 IP www.facebook > client: Flags [.], seq 24341:25789, ack 1117, win 5496, options [nop,nop,TS val 3548951728 ecr 424662558], length 1448
1283449104.942528 IP static.akamai > client: Flags [.], ack 403, win 215, options [nop,nop,TS val 1322162287 ecr 424662558], length 0
1283449104.945481 IP static.akamai > client: Flags [.], seq 1:1449, ack 403, win 215, options [nop,nop,TS val 1322162287 ecr 424662558], length 1448
1283449104.957394 IP static.akamai > client: Flags [.], seq 1449:2897, ack 403, win 215, options [nop,nop,TS val 1322162287 ecr 424662558], length 1448
1283449104.957445 IP client > static.akamai: Flags [.], ack 2897, win 65522, options [nop,nop,TS val 424662560 ecr 1322162287], length 0
1283449104.962550 IP static.akamai > client: Flags [.], seq 2897:4345, ack 403, win 215, options [nop,nop,TS val 1322162287 ecr 424662558], length 1448
1283449104.969461 IP static.akamai > client: Flags [P.], seq 4345:5791, ack 403, win 215, options [nop,nop,TS val 1322162287 ecr 424662558], length 1446
1283449104.969510 IP client > static.akamai: Flags [.], ack 5791, win 65522, options [nop,nop,TS val 424662561 ecr 1322162287], length 0
1283449104.969639 IP client > static.akamai: Flags [P.], seq 403:805, ack 5791, win 65535, options [nop,nop,TS val 424662561 ecr 1322162287], length 402
1283449104.970498 IP static.akamai > client: Flags [.], ack 403, win 215, options [nop,nop,TS val 1322162304 ecr 424662558], length 0
1283449104.972939 IP static.akamai > client: Flags [.], seq 1:1449, ack 403, win 215, options [nop,nop,TS val 1322162306 ecr 424662558], length 1448
1283449104.973808 IP static.akamai > client: Flags [P.], seq 4345:4728, ack 403, win 215, options [nop,nop,TS val 1322162306 ecr 424662558], length 383
1283449104.973822 IP client > static.akamai: Flags [.], ack 1449, win 65535, options [nop,nop,TS val 424662561 ecr 1322162306,nop,nop,sack 1 {4345:4728}], length 0
1283449104.983988 IP static.akamai > client: Flags [.], seq 1449:2897, ack 403, win 215, options [nop,nop,TS val 1322162306 ecr 424662558], length 1448
1283449104.984021 IP client > static.akamai: Flags [.], ack 2897, win 65522, options [nop,nop,TS val 424662561 ecr 1322162306,nop,nop,sack 1 {4345:4728}], length 0
1283449104.994571 IP static.akamai > client: Flags [.], seq 2897:4345, ack 403, win 215, options [nop,nop,TS val 1322162306 ecr 424662558], length 1448
1283449104.994610 IP client > static.akamai: Flags [.], ack 4728, win 65474, options [nop,nop,TS val 424662561 ecr 1322162306], length 0
1283449104.994748 IP client > static.akamai: Flags [P.], seq 403:805, ack 4728, win 65535, options [nop,nop,TS val 424662561 ecr 1322162306], length 402
1283449104.995620 IP static.akamai > client: Flags [.], ack 403, win 215, options [nop,nop,TS val 1322162329 ecr 424662559], length 0
1283449105.005301 IP static.akamai > client: Flags [.], seq 1:1449, ack 403, win 215, options [nop,nop,TS val 1322162329 ecr 424662559], length 1448
1283449105.033955 IP static.akamai > client: Flags [.], seq 1449:2897, ack 403, win 215, options [nop,nop,TS val 1322162329 ecr 424662559], length 1448
1283449105.034050 IP client > static.akamai: Flags [.], ack 2897, win 65522, options [nop,nop,TS val 424662561 ecr 1322162329], length 0
1283449105.037534 IP static.akamai > client: Flags [.], seq 2897:4345, ack 403, win 215, options [nop,nop,TS val 1322162329 ecr 424662559], length 1448
1283449105.041756 IP static.akamai > client: Flags [.], seq 4345:5793, ack 403, win 215, options [nop,nop,TS val 1322162329 ecr 424662559], length 1448
1283449105.041787 IP client > static.akamai: Flags [.], ack 5793, win 65522, options [nop,nop,TS val 424662561 ecr 1322162329], length 0
1283449105.042387 IP static.akamai > client: Flags [.], ack 403, win 215, options [nop,nop,TS val 1322162396 ecr 424662559], length 0
1283449105.045146 IP static.akamai > client: Flags [.], seq 1:1449, ack 403, win 215, options [nop,nop,TS val 1322162396 ecr 424662559], length 1448
1283449105.050463 IP static.akamai > client: Flags [.], seq 1449:2897, ack 403, win 215, options [nop,nop,TS val 1322162396 ecr 424662559], length 1448
1283449105.050510 IP client > static.akamai: Flags [.], ack 2897, win 65522, options [nop,nop,TS val 424662561 ecr 1322162396], length 0
1283449105.052268 IP static.akamai > client: Flags [P.], seq 4345:4668, ack 403, win 215, options [nop,nop,TS val 1322162396 ecr 424662559], length 323
1283449105.052298 IP client > static.akamai: Flags [.], ack 2897, win 65535, options [nop,nop,TS val 424662561 ecr 1322162396,nop,nop,sack 1 {4345:4668}], length 0
1283449105.061621 IP client > www.facebook: Flags [.], ack 25789, win 65535, options [nop,nop,TS val 424662561 ecr 3548951728], length 0
1283449105.062996 IP static.akamai > client: Flags [.], seq 2897:4345, ack 403, win 215, options [nop,nop,TS val 1322162396 ecr 424662559], length 1448
1283449105.063089 IP client > static.akamai: Flags [.], ack 4668, win 65481, options [nop,nop,TS val 424662562 ecr 1322162396], length 0
1283449105.063577 IP client > static.akamai: Flags [P.], seq 403:805, ack 4668, win 65535, options [nop,nop,TS val 424662562 ecr 1322162396], length 402
1283449105.107918 IP static.akamai > client: Flags [.], ack 403, win 215, options [nop,nop,TS val 1322162411 ecr 424662559], length 0
1283449105.120481 IP static.akamai > client: Flags [.], seq 1:1449, ack 403, win 215, options [nop,nop,TS val 1322162411 ecr 424662559], length 1448
1283449105.130493 IP static.akamai > client: Flags [P.], seq 2897:4319, ack 403, win 215, options [nop,nop,TS val 1322162411 ecr 424662559], length 1422
1283449105.130529 IP client > static.akamai: Flags [.], ack 1449, win 65535, options [nop,nop,TS val 424662562 ecr 1322162411,nop,nop,sack 1 {2897:4319}], length 0
1283449105.139383 IP static.akamai > client: Flags [.], seq 1449:2897, ack 403, win 215, options [nop,nop,TS val 1322162411 ecr 424662559], length 1448
1283449105.139439 IP client > static.akamai: Flags [.], ack 4319, win 65344, options [nop,nop,TS val 424662562 ecr 1322162411], length 0
1283449105.139612 IP client > static.akamai: Flags [P.], seq 403:789, ack 4319, win 65535, options [nop,nop,TS val 424662562 ecr 1322162411], length 386
1283449105.149405 IP www.facebook > client: Flags [.], seq 25789:27237, ack 1117, win 5496, options [nop,nop,TS val 3548951932 ecr 424662559], length 1448
1283449105.153263 IP static.akamai > client: Flags [P.], seq 4680:5648, ack 805, win 248, options [nop,nop,TS val 1322162477 ecr 424662560], length 968
1283449105.153309 IP client > static.akamai: Flags [.], ack 5648, win 65535, options [nop,nop,TS val 424662562 ecr 1322162477], length 0
1283449105.188721 IP static.akamai > client: Flags [.], seq 5791:7239, ack 805, win 248, options [nop,nop,TS val 1322162512 ecr 424662561], length 1448
1283449105.189309 IP static.akamai > client: Flags [P.], seq 10135:10153, ack 805, win 248, options [nop,nop,TS val 1322162512 ecr 424662561], length 18
1283449105.189327 IP client > static.akamai: Flags [.], ack 7239, win 65535, options [nop,nop,TS val 424662563 ecr 1322162512,nop,nop,sack 1 {10135:10153}], length 0
1283449105.197538 IP static.akamai > client: Flags [.], seq 7239:8687, ack 805, win 248, options [nop,nop,TS val 1322162512 ecr 424662561], length 1448
1283449105.197600 IP client > static.akamai: Flags [.], ack 8687, win 65522, options [nop,nop,TS val 424662563 ecr 1322162512,nop,nop,sack 1 {10135:10153}], length 0
1283449105.239002 IP static.akamai > client: Flags [.], seq 8687:10135, ack 805, win 248, options [nop,nop,TS val 1322162512 ecr 424662561], length 1448
1283449105.239109 IP client > static.akamai: Flags [.], ack 10153, win 65519, options [nop,nop,TS val 424662563 ecr 1322162512], length 0
1283449105.241139 IP static.akamai > client: Flags [P.], seq 4728:5890, ack 805, win 248, options [nop,nop,TS val 1322162564 ecr 424662561], length 1162
1283449105.241165 IP client > static.akamai: Flags [.], ack 5890, win 65535, options [nop,nop,TS val 424662563 ecr 1322162564], length 0
1283449105.252944 IP static.akamai > client: Flags [P.], seq 5793:6977, ack 403, win 215, options [nop,nop,TS val 1322162564 ecr 424662561], length 1184
1283449105.252978 IP client > static.akamai: Flags [.], ack 6977, win 65535, options [nop,nop,TS val 424662563 ecr 1322162564], length 0
1283449105.261796 IP client > www.facebook: Flags [.], ack 27237, win 65535, options [nop,nop,TS val 424662563 ecr 3548951932], length 0
1283449105.265541 IP www.facebook > client: Flags [.], seq 27237:28685, ack 1117, win 5496, options [nop,nop,TS val 3548952080 ecr 424662560], length 1448
1283449105.271048 IP www.facebook > client: Flags [.], seq 28685:30133, ack 1117, win 5496, options [nop,nop,TS val 3548952080 ecr 424662560], length 1448
1283449105.271156 IP client > www.facebook: Flags [.], ack 30133, win 65535, options [nop,nop,TS val 424662564 ecr 3548952080], length 0
1283449105.278848 IP www.facebook > client: Flags [.], seq 30133:31581, ack 1117, win 5496, options [nop,nop,TS val 3548952080 ecr 424662560], length 1448
1283449105.285744 IP www.facebook > client: Flags [.], seq 31581:33029, ack 1117, win 5496, options [nop,nop,TS val 3548952081 ecr 424662560], length 1448
1283449105.285907 IP client > www.facebook: Flags [.], ack 33029, win 65535, options [nop,nop,TS val 424662564 ecr 3548952080], length 0
1283449105.296958 IP www.facebook > client: Flags [.], seq 33029:34477, ack 1117, win 5496, options [nop,nop,TS val 3548952081 ecr 424662560], length 1448
1283449105.308545 IP www.facebook > client: Flags [.], seq 34477:35925, ack 1117, win 5496, options [nop,nop,TS val 3548952107 ecr 424662560], length 1448
1283449105.308740 IP client > www.facebook: Flags [.], ack 35925, win 65535, options [nop,nop,TS val 424662564 ecr 3548952081], length 0
1283449105.332126 IP www.facebook > client: Flags [.], seq 35925:37373, ack 1117, win 5496, options [nop,nop,TS val 3548952107 ecr 424662560], length 1448
1283449105.333981 IP static.akamai > client: Flags [P.], seq 6116:6182, ack 805, win 248, options [nop,nop,TS val 1322162671 ecr 424662562], length 66
1283449105.334079 IP client > static.akamai: Flags [.], ack 4668, win 65535, options [nop,nop,TS val 424662564 ecr 1322162396,nop,nop,sack 1 {6116:6182}], length 0
1283449105.334295 IP static.akamai > client: Flags [.], seq 4668:6116, ack 805, win 248, options [nop,nop,TS val 1322162671 ecr 424662562], length 1448
1283449105.334318 IP client > static.akamai: Flags [.], ack 6182, win 65513, options [nop,nop,TS val 424662564 ecr 1322162671], length 0
1283449105.413875 IP static.akamai > client: Flags [.], seq 4319:5767, ack 789, win 248, options [nop,nop,TS val 1322162671 ecr 424662562], length 1448
1283449105.415268 IP static.akamai > client: Flags [.], seq 5767:7215, ack 789, win 248, options [nop,nop,TS val 1322162671 ecr 424662562], length 1448
1283449105.415365 IP client > static.akamai: Flags [.], ack 7215, win 65535, options [nop,nop,TS val 424662565 ecr 1322162671], length 0
1283449105.416958 IP static.akamai > client: Flags [.], seq 7215:8663, ack 789, win 248, options [nop,nop,TS val 1322162671 ecr 424662562], length 1448
1283449105.416985 IP client > static.akamai: Flags [.], ack 8663, win 65522, options [nop,nop,TS val 424662565 ecr 1322162671], length 0
1283449105.419577 IP static.akamai > client: Flags [.], seq 8663:10111, ack 789, win 248, options [nop,nop,TS val 1322162671 ecr 424662562], length 1448
1283449105.420533 IP static.akamai > client: Flags [.], seq 10111:11559, ack 789, win 248, options [nop,nop,TS val 1322162671 ecr 424662562], length 1448
1283449105.420584 IP client > static.akamai: Flags [.], ack 11559, win 65535, options [nop,nop,TS val 424662565 ecr 1322162671], length 0
1283449105.423198 IP www.facebook > client: Flags [.], seq 37373:38821, ack 1117, win 5496, options [nop,nop,TS val 3548952152 ecr 424662561], length 1448
1283449105.423230 IP client > www.facebook: Flags [.], ack 38821, win 65522, options [nop,nop,TS val 424662565 ecr 3548952107], length 0
1283449105.425077 IP www.facebook > client: Flags [.], seq 38821:40269, ack 1117, win 5496, options [nop,nop,TS val 3548952152 ecr 424662561], length 1448
1283449105.427700 IP www.facebook > client: Flags [.], seq 40269:41717, ack 1117, win 5496, options [nop,nop,TS val 3548952152 ecr 424662561], length 1448
1283449105.427719 IP client > www.facebook: Flags [.], ack 41717, win 65522, options [nop,nop,TS val 424662565 ecr 3548952152], length 0
1283449105.428694 IP www.facebook > client: Flags [.], seq 41717:43165, ack 1117, win 5496, options [nop,nop,TS val 3548952152 ecr 424662561], length 1448
1283449105.431772 IP www.facebook > client: Flags [.], seq 43165:44613, ack 1117, win 5496, options [nop,nop,TS val 3548952152 ecr 424662561], length 1448
1283449105.431800 IP client > www.facebook: Flags [.], ack 44613, win 65522, options [nop,nop,TS val 424662565 ecr 3548952152], length 0
1283449105.432631 IP www.facebook > client: Flags [.], seq 44613:46061, ack 1117, win 5496, options [nop,nop,TS val 3548952181 ecr 424662561], length 1448
1283449105.434368 IP www.facebook > client: Flags [P.], seq 46061:46635, ack 1117, win 5496, options [nop,nop,TS val 3548952183 ecr 424662561], length 574
1283449105.434395 IP client > www.facebook: Flags [.], ack 46635, win 65535, options [nop,nop,TS val 424662565 ecr 3548952181], length 0
1283449105.557137 IP static.akamai > client: Flags [.], seq 11559:13007, ack 789, win 248, options [nop,nop,TS val 1322162923 ecr 424662565], length 1448
1283449105.566820 IP static.akamai > client: Flags [.], seq 13007:14455, ack 789, win 248, options [nop,nop,TS val 1322162923 ecr 424662565], length 1448
1283449105.566923 IP client > static.akamai: Flags [.], ack 14455, win 65535, options [nop,nop,TS val 424662567 ecr 1322162923], length 0
1283449105.575400 IP static.akamai > client: Flags [P.], seq 14455:15683, ack 789, win 248, options [nop,nop,TS val 1322162923 ecr 424662565], length 1228
1283449105.575440 IP client > static.akamai: Flags [.], ack 15683, win 65535, options [nop,nop,TS val 424662567 ecr 1322162923], length 0
1283449105.591760 IP client > static.akamai: Flags [P.], seq 805:1222, ack 5648, win 65535, options [nop,nop,TS val 424662567 ecr 1322162477], length 417
1283449105.593032 IP client > static.akamai: Flags [P.], seq 805:1222, ack 10153, win 65535, options [nop,nop,TS val 424662567 ecr 1322162512], length 417
1283449105.594924 IP client > dns: 16804+ A? profile.ak.fbcdn.net. (38)
1283449105.597920 IP client > static.akamai: Flags [P.], seq 805:1257, ack 5890, win 65535, options [nop,nop,TS val 424662567 ecr 1322162564], length 452
1283449105.605168 IP client > dns: 49429+ AAAA? profile.ak.fbcdn.net. (38)
1283449105.635231 IP client > static.akamai: Flags [P.], seq 403:855, ack 6977, win 65535, options [nop,nop,TS val 424662567 ecr 1322162564], length 452
1283449105.636329 IP client > static.akamai: Flags [P.], seq 805:1257, ack 6182, win 65535, options [nop,nop,TS val 424662567 ecr 1322162671], length 452
1283449105.638146 IP client > static.akamai: Flags [P.], seq 789:1191, ack 15683, win 65535, options [nop,nop,TS val 424662567 ecr 1322162923], length 402
1283449105.662015 IP client > dns: 12344+ A? external.ak.fbcdn.net. (39)
1283449105.672260 IP client > dns: 10510+ AAAA? external.ak.fbcdn.net. (39)
1283449105.694424 IP client > static.akamai: Flags [S], seq 4272120904, win 65535, options [mss 1460,nop,wscale 3,nop,nop,TS val 424662568 ecr 0,sackOK,eol], length 0
1283449105.758274 IP static.akamai > client: Flags [P.], seq 5648:6452, ack 1222, win 282, options [nop,nop,TS val 1322163105 ecr 424662567], length 804
1283449105.758313 IP client > static.akamai: Flags [.], ack 6452, win 65535, options [nop,nop,TS val 424662568 ecr 1322163105], length 0
1283449105.758513 IP client > static.akamai: Flags [P.], seq 1222:1639, ack 6452, win 65535, options [nop,nop,TS val 424662568 ecr 1322163105], length 417
1283449105.761400 IP dns > client: 16804 7/9/9 CNAME profile.ak.facebook.com.edgesuite.net., CNAME a1725.l.akamai.net., A 65.171.167.122, A 65.171.167.128, A 65.171.167.138, A 65.171.167.145, A 65.171.167.121 (501)
1283449105.763150 IP static.akamai > client: Flags [P.], seq 10153:10528, ack 1222, win 282, options [nop,nop,TS val 1322163116 ecr 424662567], length 375
1283449105.763186 IP client > static.akamai: Flags [.], ack 10528, win 65535, options [nop,nop,TS val 424662569 ecr 1322163116], length 0
1283449105.763348 IP client > static.akamai: Flags [P.], seq 1222:1674, ack 10528, win 65535, options [nop,nop,TS val 424662569 ecr 1322163116], length 452
1283449105.853884 IP dns > client: 49429 2/1/0 CNAME profile.ak.facebook.com.edgesuite.net., CNAME a1725.l.akamai.net. (176)
1283449105.862752 IP static.akamai > client: Flags [.], seq 5890:7338, ack 1257, win 282, options [nop,nop,TS val 1322163176 ecr 424662567], length 1448
1283449105.873001 IP static.akamai > client: Flags [P.], seq 8786:9563, ack 1257, win 282, options [nop,nop,TS val 1322163176 ecr 424662567], length 777
1283449105.873048 IP client > static.akamai: Flags [.], ack 7338, win 65535, options [nop,nop,TS val 424662570 ecr 1322163176,nop,nop,sack 1 {8786:9563}], length 0
1283449105.887096 IP static.akamai > client: Flags [.], seq 7338:8786, ack 1257, win 282, options [nop,nop,TS val 1322163176 ecr 424662567], length 1448
1283449105.887148 IP client > static.akamai: Flags [.], ack 9563, win 65424, options [nop,nop,TS val 424662570 ecr 1322163176], length 0
1283449105.887282 IP client > static.akamai: Flags [P.], seq 1257:1709, ack 9563, win 65535, options [nop,nop,TS val 424662570 ecr 1322163176], length 452
1283449105.911897 IP static.akamai > client: Flags [P.], seq 8425:9392, ack 855, win 248, options [nop,nop,TS val 1322163218 ecr 424662567], length 967
1283449105.911994 IP client > static.akamai: Flags [.], ack 6977, win 65535, options [nop,nop,TS val 424662570 ecr 1322162564,nop,nop,sack 1 {8425:9392}], length 0
1283449105.919944 IP static.akamai > client: Flags [.], seq 6977:8425, ack 855, win 248, options [nop,nop,TS val 1322163218 ecr 424662567], length 1448
1283449105.920031 IP client > static.akamai: Flags [.], ack 9392, win 65401, options [nop,nop,TS val 424662570 ecr 1322163218], length 0
1283449105.920552 IP client > static.akamai: Flags [P.], seq 855:1307, ack 9392, win 65535, options [nop,nop,TS val 424662570 ecr 1322163218], length 452
1283449105.920776 IP static.akamai > client: Flags [P.], seq 7630:7857, ack 1257, win 282, options [nop,nop,TS val 1322163231 ecr 424662567], length 227
1283449105.920798 IP client > static.akamai: Flags [.], ack 6182, win 65535, options [nop,nop,TS val 424662570 ecr 1322162671,nop,nop,sack 1 {7630:7857}], length 0
1283449105.930630 IP client > profile.akamai: Flags [S], seq 1572967574, win 65535, options [mss 1460,nop,wscale 3,nop,nop,TS val 424662570 ecr 0,sackOK,eol], length 0
1283449105.930814 IP client > profile.akamai: Flags [S], seq 2319349633, win 65535, options [mss 1460,nop,wscale 3,nop,nop,TS val 424662570 ecr 0,sackOK,eol], length 0
1283449105.931080 IP static.akamai > client: Flags [.], seq 6182:7630, ack 1257, win 282, options [nop,nop,TS val 1322163231 ecr 424662567], length 1448
1283449105.931108 IP client > static.akamai: Flags [.], ack 7857, win 65493, options [nop,nop,TS val 424662570 ecr 1322163231], length 0
1283449105.931187 IP client > profile.akamai: Flags [S], seq 3696646200, win 65535, options [mss 1460,nop,wscale 3,nop,nop,TS val 424662570 ecr 0,sackOK,eol], length 0
1283449105.931373 IP client > profile.akamai: Flags [S], seq 2769947929, win 65535, options [mss 1460,nop,wscale 3,nop,nop,TS val 424662570 ecr 0,sackOK,eol], length 0
1283449105.931489 IP client > profile.akamai: Flags [S], seq 4292387092, win 65535, options [mss 1460,nop,wscale 3,nop,nop,TS val 424662570 ecr 0,sackOK,eol], length 0
1283449105.931578 IP client > profile.akamai: Flags [S], seq 2195630901, win 65535, options [mss 1460,nop,wscale 3,nop,nop,TS val 424662570 ecr 0,sackOK,eol], length 0
1283449105.931713 IP client > static.akamai: Flags [P.], seq 1257:1709, ack 7857, win 65535, options [nop,nop,TS val 424662570 ecr 1322163231], length 452
1283449105.931864 IP dns > client: 10510 2/1/0 CNAME external.ak.fbcdn.net.edgesuite.net., CNAME a1920.g.akamai.net. (175)
1283449105.932122 IP client > dns: 42+ A? a1920.g.akamai.net. (36)
1283449105.935268 IP dns > client: 12344 4/9/9 CNAME external.ak.fbcdn.net.edgesuite.net., CNAME a1920.g.akamai.net., A 65.171.167.139, A 65.171.167.138 (452)
1283449105.935779 IP static.akamai > client: Flags [S.], seq 2930142480, ack 4272120905, win 5792, options [mss 1460,sackOK,TS val 1322163278 ecr 424662568,nop,wscale 5], length 0
1283449105.935814 IP client > static.akamai: Flags [.], ack 1, win 65535, options [nop,nop,TS val 424662570 ecr 1322163278], length 0
1283449105.935923 IP client > static.akamai: Flags [P.], seq 1:1156, ack 1, win 65535, options [nop,nop,TS val 424662570 ecr 1322163278], length 1155
1283449105.942925 IP client > dns: 45569+ AAAA? a1920.g.akamai.net. (36)
1283449105.947040 IP static.akamai > client: Flags [P.], seq 15683:16922, ack 1191, win 282, options [nop,nop,TS val 1322163279 ecr 424662567], length 1239
1283449105.947086 IP client > static.akamai: Flags [.], ack 16922, win 65535, options [nop,nop,TS val 424662570 ecr 1322163279], length 0
1283449105.953906 IP static.akamai > client: Flags [P.], seq 6452:6955, ack 1639, win 315, options [nop,nop,TS val 1322163331 ecr 424662568], length 503
1283449105.953941 IP client > static.akamai: Flags [.], ack 6955, win 65535, options [nop,nop,TS val 424662570 ecr 1322163331], length 0
1283449105.954423 IP static.akamai > client: Flags [S.], seq 2930142480, ack 4272120905, win 5792, options [mss 1460,sackOK,TS val 1322163331 ecr 424662568,nop,wscale 5], length 0
1283449105.954436 IP client > static.akamai: Flags [.], ack 1, win 65535, options [nop,nop,TS val 424662570 ecr 1322163331], length 0
1283449105.961466 IP static.akamai > client: Flags [P.], seq 10528:11122, ack 1674, win 315, options [nop,nop,TS val 1322163337 ecr 424662569], length 594
1283449105.961514 IP client > static.akamai: Flags [.], ack 11122, win 65535, options [nop,nop,TS val 424662570 ecr 1322163337], length 0
1283449106.017033 IP client > static.akamai: Flags [P.], seq 1191:1593, ack 16922, win 65535, options [nop,nop,TS val 424662571 ecr 1322163279], length 402
1283449106.019566 IP client > static.akamai: Flags [P.], seq 1639:2041, ack 6955, win 65535, options [nop,nop,TS val 424662571 ecr 1322163331], length 402
1283449106.022298 IP client > static.akamai: Flags [P.], seq 1674:2126, ack 11122, win 65535, options [nop,nop,TS val 424662571 ecr 1322163337], length 452
1283449106.029500 IP static.akamai > client: Flags [.], seq 9563:11011, ack 1709, win 315, options [nop,nop,TS val 1322163392 ecr 424662570], length 1448
1283449106.037632 IP static.akamai > client: Flags [.], seq 11011:12459, ack 1709, win 315, options [nop,nop,TS val 1322163392 ecr 424662570], length 1448
1283449106.037696 IP client > static.akamai: Flags [.], ack 12459, win 65535, options [nop,nop,TS val 424662571 ecr 1322163392], length 0
1283449106.042611 IP static.akamai > client: Flags [.], seq 12459:13907, ack 1709, win 315, options [nop,nop,TS val 1322163392 ecr 424662570], length 1448
1283449106.042629 IP client > static.akamai: Flags [.], ack 13907, win 65522, options [nop,nop,TS val 424662571 ecr 1322163392], length 0
1283449106.044803 IP client > dns: 33656+ A? photos-d.ak.fbcdn.net. (39)
1283449106.051560 IP static.akamai > client: Flags [P.], seq 15355:16457, ack 1709, win 315, options [nop,nop,TS val 1322163392 ecr 424662570], length 1102
1283449106.051586 IP client > static.akamai: Flags [.], ack 13907, win 65535, options [nop,nop,TS val 424662571 ecr 1322163392,nop,nop,sack 1 {15355:16457}], length 0
1283449106.053960 IP client > dns: 26818+ AAAA? photos-d.ak.fbcdn.net. (39)
1283449106.063749 IP static.akamai > client: Flags [.], seq 13907:15355, ack 1709, win 315, options [nop,nop,TS val 1322163392 ecr 424662570], length 1448
1283449106.063777 IP client > static.akamai: Flags [.], ack 16457, win 65384, options [nop,nop,TS val 424662572 ecr 1322163392], length 0
1283449106.063893 IP client > static.akamai: Flags [P.], seq 1709:2111, ack 16457, win 65535, options [nop,nop,TS val 424662572 ecr 1322163392], length 402
1283449106.064131 IP client > dns: 40836+ A? platform.ak.fbcdn.net. (39)
1283449106.074337 IP client > dns: 40311+ AAAA? platform.ak.fbcdn.net. (39)
1283449106.084604 IP client > dns: 52999+ A? photos-e.ak.fbcdn.net. (39)
1283449106.094792 IP client > dns: 61897+ AAAA? photos-e.ak.fbcdn.net. (39)
1283449106.103978 IP client > dns: 60131+ A? photos-h.ak.fbcdn.net. (39)
1283449106.114519 IP client > dns: 29126+ AAAA? photos-h.ak.fbcdn.net. (39)
1283449106.222661 IP static.akamai > client: Flags [P.], seq 9392:10253, ack 1307, win 282, options [nop,nop,TS val 1322163421 ecr 424662570], length 861
1283449106.222719 IP client > static.akamai: Flags [.], ack 10253, win 65535, options [nop,nop,TS val 424662573 ecr 1322163421], length 0
1283449106.222930 IP client > static.akamai: Flags [P.], seq 1307:1709, ack 10253, win 65535, options [nop,nop,TS val 424662573 ecr 1322163421], length 402
1283449106.223633 IP profile.akamai > client: Flags [S.], seq 3254076212, ack 3696646201, win 5792, options [mss 1460,sackOK,TS val 1026597128 ecr 424662570,nop,wscale 5], length 0
1283449106.223655 IP client > profile.akamai: Flags [.], ack 1, win 65535, options [nop,nop,TS val 424662573 ecr 1026597128], length 0
1283449106.223766 IP client > profile.akamai: Flags [P.], seq 1:442, ack 1, win 65535, options [nop,nop,TS val 424662573 ecr 1026597128], length 441
1283449106.225250 IP profile.akamai > client: Flags [S.], seq 3245450721, ack 2195630902, win 5792, options [mss 1460,sackOK,TS val 1026597128 ecr 424662570,nop,wscale 5], length 0
1283449106.225273 IP client > profile.akamai: Flags [.], ack 1, win 65535, options [nop,nop,TS val 424662573 ecr 1026597128], length 0
1283449106.225392 IP client > profile.akamai: Flags [P.], seq 1:441, ack 1, win 65535, options [nop,nop,TS val 424662573 ecr 1026597128], length 440
1283449106.225492 IP profile.akamai > client: Flags [S.], seq 3247300890, ack 1572967575, win 5792, options [mss 1460,sackOK,TS val 1026597128 ecr 424662570,nop,wscale 5], length 0
1283449106.225512 IP client > profile.akamai: Flags [.], ack 1, win 65535, options [nop,nop,TS val 424662573 ecr 1026597128], length 0
1283449106.225599 IP client > profile.akamai: Flags [P.], seq 1:447, ack 1, win 65535, options [nop,nop,TS val 424662573 ecr 1026597128], length 446
1283449106.226757 IP profile.akamai > client: Flags [S.], seq 3252707619, ack 2319349634, win 5792, options [mss 1460,sackOK,TS val 1026597128 ecr 424662570,nop,wscale 5], length 0
1283449106.226780 IP client > profile.akamai: Flags [.], ack 1, win 65535, options [nop,nop,TS val 424662573 ecr 1026597128], length 0
1283449106.226875 IP client > profile.akamai: Flags [P.], seq 1:441, ack 1, win 65535, options [nop,nop,TS val 424662573 ecr 1026597128], length 440
1283449106.227521 IP profile.akamai > client: Flags [S.], seq 3248393254, ack 2769947930, win 5792, options [mss 1460,sackOK,TS val 1026597128 ecr 424662570,nop,wscale 5], length 0
1283449106.227545 IP client > profile.akamai: Flags [.], ack 1, win 65535, options [nop,nop,TS val 424662573 ecr 1026597128], length 0
1283449106.227557 IP profile.akamai > client: Flags [S.], seq 3242547418, ack 4292387093, win 5792, options [mss 1460,sackOK,TS val 1026597128 ecr 424662570,nop,wscale 5], length 0
1283449106.227569 IP client > profile.akamai: Flags [.], ack 1, win 65535, options [nop,nop,TS val 424662573 ecr 1026597128], length 0
1283449106.228051 IP client > profile.akamai: Flags [P.], seq 1:443, ack 1, win 65535, options [nop,nop,TS val 424662573 ecr 1026597128], length 442
1283449106.228082 IP client > profile.akamai: Flags [P.], seq 1:441, ack 1, win 65535, options [nop,nop,TS val 424662573 ecr 1026597128], length 440
1283449106.229287 IP dns > client: 42 2/9/9 A 65.171.167.138, A 65.171.167.139 (374)
1283449106.231566 IP static.akamai > client: Flags [P.], seq 7857:8250, ack 1709, win 315, options [nop,nop,TS val 1322163452 ecr 424662570], length 393
1283449106.231615 IP client > static.akamai: Flags [.], ack 8250, win 65535, options [nop,nop,TS val 424662573 ecr 1322163452], length 0
1283449106.231879 IP client > static.akamai: Flags [P.], seq 1709:2111, ack 8250, win 65535, options [nop,nop,TS val 424662573 ecr 1322163452], length 402
1283449106.232380 IP static.akamai > client: Flags [.], ack 1156, win 254, options [nop,nop,TS val 1322163500 ecr 424662570], length 0
1283449106.237742 IP static.akamai > client: Flags [P.], seq 1:603, ack 1156, win 254, options [nop,nop,TS val 1322163502 ecr 424662570], length 602
1283449106.237791 IP client > static.akamai: Flags [.], ack 603, win 65535, options [nop,nop,TS val 424662573 ecr 1322163502], length 0
1283449106.238052 IP dns > client: 45569 0/1/0 (97)
