# Anatomy of a RickRoll (4 seconds of video)
00:00:00.000000 IP client > youtube: Flags [S], seq 2880643263, win 65535, options [mss 1460,nop,wscale 1,nop,nop,TS val 423701863 ecr 0,sackOK,eol], length 0
00:00:00.163316 IP youtube > client: Flags [S.], seq 3283178163, ack 2880643264, win 5792, options [mss 1460,sackOK,TS val 1261876858 ecr 423701863,nop,wscale 6], length 0
00:00:00.163379 IP client > youtube: Flags [.], ack 1, win 33304, options [nop,nop,TS val 423701864 ecr 1261876858], length 0
00:00:00.163482 IP client > youtube: Flags [P.], seq 1:1018, ack 1, win 33304, options [nop,nop,TS val 423701864 ecr 1261876858], length 1017
00:00:00.326027 IP youtube > client: Flags [.], ack 1018, win 123, options [nop,nop,TS val 1261877021 ecr 423701864], length 0
00:00:00.326033 IP youtube > client: Flags [.], ack 1018, win 123, options [nop,nop,TS val 1261877021 ecr 423701864], length 0
00:00:00.326270 IP youtube > client: Flags [P.], seq 1:126, ack 1018, win 123, options [nop,nop,TS val 1261877022 ecr 423701864], length 125
00:00:00.326298 IP client > youtube: Flags [.], ack 126, win 33241, options [nop,nop,TS val 423701866 ecr 1261877022], length 0
00:00:00.573031 IP client > youtube: Flags [P.], seq 1018:2075, ack 126, win 33304, options [nop,nop,TS val 423702078 ecr 1261877022], length 1057
00:00:00.746956 IP youtube > client: Flags [P.], seq 126:450, ack 2075, win 156, options [nop,nop,TS val 1261898440 ecr 423702078], length 324
00:00:00.747029 IP youtube > client: Flags [P.], seq 450:742, ack 2075, win 156, options [nop,nop,TS val 1261898440 ecr 423702078], length 292
00:00:00.747050 IP client > youtube: Flags [.], ack 450, win 33142, options [nop,nop,TS val 423702080 ecr 1261898440], length 0
00:00:00.747093 IP client > youtube: Flags [.], ack 742, win 32996, options [nop,nop,TS val 423702080 ecr 1261898440], length 0
00:00:00.747209 IP youtube > client: Flags [P.], seq 742:765, ack 2075, win 156, options [nop,nop,TS val 1261898440 ecr 423702078], length 23
00:00:00.747230 IP client > youtube: Flags [.], ack 765, win 33292, options [nop,nop,TS val 423702080 ecr 1261898440], length 0
00:00:00.747812 IP youtube > client: Flags [P.], seq 765:774, ack 2075, win 156, options [nop,nop,TS val 1261898440 ecr 423702078], length 9
00:00:00.747858 IP client > youtube: Flags [.], ack 774, win 33299, options [nop,nop,TS val 423702080 ecr 1261898440], length 0
00:00:00.908932 IP youtube > client: Flags [.], seq 774:2222, ack 2075, win 156, options [nop,nop,TS val 1261898603 ecr 423702080], length 1448
00:00:00.909180 IP youtube > client: Flags [.], seq 2222:3670, ack 2075, win 156, options [nop,nop,TS val 1261898603 ecr 423702080], length 1448
00:00:00.909210 IP client > youtube: Flags [.], ack 3670, win 32580, options [nop,nop,TS val 423702081 ecr 1261898603], length 0
00:00:00.909549 IP youtube > client: Flags [.], seq 3670:5118, ack 2075, win 156, options [nop,nop,TS val 1261898603 ecr 423702080], length 1448
00:00:00.909578 IP client > youtube: Flags [.], ack 5118, win 33304, options [nop,nop,TS val 423702081 ecr 1261898603], length 0
00:00:00.910141 IP youtube > client: Flags [.], seq 5118:6566, ack 2075, win 156, options [nop,nop,TS val 1261898603 ecr 423702080], length 1448
00:00:00.910161 IP client > youtube: Flags [.], ack 6566, win 32580, options [nop,nop,TS val 423702081 ecr 1261898603], length 0
00:00:00.916272 IP youtube > client: Flags [.], seq 6566:8014, ack 2075, win 156, options [nop,nop,TS val 1261898610 ecr 423702080], length 1448
00:00:00.916386 IP client > youtube: Flags [.], ack 8014, win 33304, options [nop,nop,TS val 423702081 ecr 1261898610], length 0
00:00:00.916487 IP youtube > client: Flags [.], seq 8014:9462, ack 2075, win 156, options [nop,nop,TS val 1261898610 ecr 423702080], length 1448
00:00:00.916504 IP client > youtube: Flags [.], ack 9462, win 32580, options [nop,nop,TS val 423702081 ecr 1261898610], length 0
00:00:00.917142 IP youtube > client: Flags [.], seq 9462:10910, ack 2075, win 156, options [nop,nop,TS val 1261898610 ecr 423702080], length 1448
00:00:00.917183 IP client > youtube: Flags [.], ack 10910, win 33304, options [nop,nop,TS val 423702081 ecr 1261898610], length 0
00:00:00.917483 IP youtube > client: Flags [.], seq 10910:12358, ack 2075, win 156, options [nop,nop,TS val 1261898610 ecr 423702080], length 1448
00:00:00.920054 IP client > youtube: Flags [.], ack 12358, win 33304, options [nop,nop,TS val 423702081 ecr 1261898610], length 0
00:00:01.076613 IP youtube > client: Flags [.], seq 12358:13806, ack 2075, win 156, options [nop,nop,TS val 1261898771 ecr 423702081], length 1448
00:00:01.077468 IP youtube > client: Flags [.], seq 13806:15254, ack 2075, win 156, options [nop,nop,TS val 1261898771 ecr 423702081], length 1448
00:00:01.077528 IP client > youtube: Flags [.], ack 15254, win 33304, options [nop,nop,TS val 423702083 ecr 1261898771], length 0
00:00:01.077859 IP youtube > client: Flags [.], seq 15254:16702, ack 2075, win 156, options [nop,nop,TS val 1261898771 ecr 423702081], length 1448
00:00:01.078369 IP youtube > client: Flags [.], seq 16702:18150, ack 2075, win 156, options [nop,nop,TS val 1261898771 ecr 423702081], length 1448
00:00:01.078397 IP client > youtube: Flags [.], ack 18150, win 33304, options [nop,nop,TS val 423702083 ecr 1261898771], length 0
00:00:01.078754 IP youtube > client: Flags [.], seq 18150:19598, ack 2075, win 156, options [nop,nop,TS val 1261898771 ecr 423702081], length 1448
00:00:01.079400 IP youtube > client: Flags [.], seq 19598:21046, ack 2075, win 156, options [nop,nop,TS val 1261898774 ecr 423702081], length 1448
00:00:01.079432 IP client > youtube: Flags [.], ack 21046, win 33304, options [nop,nop,TS val 423702083 ecr 1261898771], length 0
00:00:01.079948 IP youtube > client: Flags [.], seq 21046:22494, ack 2075, win 156, options [nop,nop,TS val 1261898774 ecr 423702081], length 1448
00:00:01.084408 IP youtube > client: Flags [.], seq 22494:23942, ack 2075, win 156, options [nop,nop,TS val 1261898778 ecr 423702081], length 1448
00:00:01.084480 IP client > youtube: Flags [.], ack 23942, win 33304, options [nop,nop,TS val 423702083 ecr 1261898774], length 0
00:00:01.084745 IP youtube > client: Flags [.], seq 23942:25390, ack 2075, win 156, options [nop,nop,TS val 1261898778 ecr 423702081], length 1448
00:00:01.084762 IP client > youtube: Flags [.], ack 25390, win 32580, options [nop,nop,TS val 423702083 ecr 1261898778], length 0
00:00:01.085352 IP youtube > client: Flags [.], seq 25390:26838, ack 2075, win 156, options [nop,nop,TS val 1261898778 ecr 423702081], length 1448
00:00:01.085411 IP client > youtube: Flags [.], ack 26838, win 33304, options [nop,nop,TS val 423702083 ecr 1261898778], length 0
00:00:01.085949 IP youtube > client: Flags [.], seq 26838:28286, ack 2075, win 156, options [nop,nop,TS val 1261898778 ecr 423702081], length 1448
00:00:01.087618 IP youtube > client: Flags [.], seq 28286:29734, ack 2075, win 156, options [nop,nop,TS val 1261898782 ecr 423702081], length 1448
00:00:01.087710 IP client > youtube: Flags [.], ack 29734, win 33304, options [nop,nop,TS val 423702083 ecr 1261898778], length 0
00:00:01.087918 IP youtube > client: Flags [.], seq 29734:31182, ack 2075, win 156, options [nop,nop,TS val 1261898782 ecr 423702081], length 1448
00:00:01.088469 IP youtube > client: Flags [.], seq 31182:32630, ack 2075, win 156, options [nop,nop,TS val 1261898782 ecr 423702081], length 1448
00:00:01.088507 IP client > youtube: Flags [.], ack 32630, win 33304, options [nop,nop,TS val 423702083 ecr 1261898782], length 0
00:00:01.089028 IP youtube > client: Flags [.], seq 32630:34078, ack 2075, win 156, options [nop,nop,TS val 1261898782 ecr 423702081], length 1448
00:00:01.120208 IP client > youtube: Flags [.], ack 34078, win 33304, options [nop,nop,TS val 423702083 ecr 1261898782], length 0
00:00:01.239454 IP youtube > client: Flags [P.], seq 34078:35526, ack 2075, win 156, options [nop,nop,TS val 1261898933 ecr 423702083], length 1448
00:00:01.239514 IP client > youtube: Flags [.], ack 35526, win 32580, options [nop,nop,TS val 423702085 ecr 1261898933], length 0
00:00:01.239704 IP youtube > client: Flags [.], seq 35526:36974, ack 2075, win 156, options [nop,nop,TS val 1261898933 ecr 423702083], length 1448
00:00:01.239756 IP client > youtube: Flags [.], ack 36974, win 33304, options [nop,nop,TS val 423702085 ecr 1261898933], length 0
00:00:01.240297 IP youtube > client: Flags [.], seq 36974:38422, ack 2075, win 156, options [nop,nop,TS val 1261898933 ecr 423702083], length 1448
00:00:01.242945 IP youtube > client: Flags [.], seq 38422:39870, ack 2075, win 156, options [nop,nop,TS val 1261898937 ecr 423702083], length 1448
00:00:01.243002 IP client > youtube: Flags [.], ack 39870, win 33304, options [nop,nop,TS val 423702085 ecr 1261898933], length 0
00:00:01.243094 IP youtube > client: Flags [.], seq 39870:41318, ack 2075, win 156, options [nop,nop,TS val 1261898937 ecr 423702083], length 1448
00:00:01.243642 IP youtube > client: Flags [.], seq 41318:42766, ack 2075, win 156, options [nop,nop,TS val 1261898937 ecr 423702083], length 1448
00:00:01.243830 IP client > youtube: Flags [.], ack 42766, win 33304, options [nop,nop,TS val 423702085 ecr 1261898937], length 0
00:00:01.244002 IP youtube > client: Flags [.], seq 42766:44214, ack 2075, win 156, options [nop,nop,TS val 1261898937 ecr 423702083], length 1448
00:00:01.246018 IP youtube > client: Flags [.], seq 44214:45662, ack 2075, win 156, options [nop,nop,TS val 1261898937 ecr 423702083], length 1448
00:00:01.246102 IP client > youtube: Flags [.], ack 45662, win 33304, options [nop,nop,TS val 423702085 ecr 1261898937], length 0
00:00:01.246231 IP youtube > client: Flags [.], seq 45662:47110, ack 2075, win 156, options [nop,nop,TS val 1261898937 ecr 423702083], length 1448
00:00:01.246788 IP youtube > client: Flags [.], seq 47110:48558, ack 2075, win 156, options [nop,nop,TS val 1261898941 ecr 423702083], length 1448
00:00:01.246803 IP client > youtube: Flags [.], ack 48558, win 32580, options [nop,nop,TS val 423702085 ecr 1261898937], length 0
00:00:01.247130 IP youtube > client: Flags [.], seq 48558:50006, ack 2075, win 156, options [nop,nop,TS val 1261898941 ecr 423702083], length 1448
00:00:01.247155 IP client > youtube: Flags [.], ack 50006, win 33304, options [nop,nop,TS val 423702085 ecr 1261898941], length 0
00:00:01.247827 IP youtube > client: Flags [.], seq 50006:51454, ack 2075, win 156, options [nop,nop,TS val 1261898941 ecr 423702083], length 1448
00:00:01.248218 IP youtube > client: Flags [.], seq 51454:52902, ack 2075, win 156, options [nop,nop,TS val 1261898941 ecr 423702083], length 1448
00:00:01.248244 IP client > youtube: Flags [.], ack 52902, win 33304, options [nop,nop,TS val 423702085 ecr 1261898941], length 0
00:00:01.248735 IP youtube > client: Flags [.], seq 52902:54350, ack 2075, win 156, options [nop,nop,TS val 1261898941 ecr 423702083], length 1448
00:00:01.251359 IP youtube > client: Flags [.], seq 54350:55798, ack 2075, win 156, options [nop,nop,TS val 1261898945 ecr 423702083], length 1448
00:00:01.251419 IP client > youtube: Flags [.], ack 55798, win 33304, options [nop,nop,TS val 423702085 ecr 1261898941], length 0
00:00:01.251689 IP youtube > client: Flags [.], seq 55798:57246, ack 2075, win 156, options [nop,nop,TS val 1261898945 ecr 423702083], length 1448
00:00:01.257939 IP youtube > client: Flags [.], seq 57246:58694, ack 2075, win 156, options [nop,nop,TS val 1261898952 ecr 423702083], length 1448
00:00:01.258042 IP client > youtube: Flags [.], ack 58694, win 33304, options [nop,nop,TS val 423702085 ecr 1261898945], length 0
00:00:01.258063 IP youtube > client: Flags [.], seq 58694:60142, ack 2075, win 156, options [nop,nop,TS val 1261898952 ecr 423702083], length 1448
00:00:01.258404 IP youtube > client: Flags [.], seq 60142:61590, ack 2075, win 156, options [nop,nop,TS val 1261898952 ecr 423702083], length 1448
00:00:01.258439 IP client > youtube: Flags [.], ack 61590, win 32580, options [nop,nop,TS val 423702085 ecr 1261898952], length 0
00:00:01.259061 IP youtube > client: Flags [.], seq 61590:63038, ack 2075, win 156, options [nop,nop,TS val 1261898952 ecr 423702083], length 1448
00:00:01.259104 IP client > youtube: Flags [.], ack 63038, win 33304, options [nop,nop,TS val 423702085 ecr 1261898952], length 0
00:00:01.259594 IP youtube > client: Flags [.], seq 63038:64486, ack 2075, win 156, options [nop,nop,TS val 1261898952 ecr 423702083], length 1448
00:00:01.259992 IP youtube > client: Flags [.], seq 64486:65934, ack 2075, win 156, options [nop,nop,TS val 1261898952 ecr 423702083], length 1448
00:00:01.260025 IP client > youtube: Flags [.], ack 65934, win 33304, options [nop,nop,TS val 423702085 ecr 1261898952], length 0
00:00:01.282749 IP youtube > client: Flags [.], seq 65934:67382, ack 2075, win 156, options [nop,nop,TS val 1261898977 ecr 423702083], length 1448
00:00:01.283021 IP youtube > client: Flags [.], seq 67382:68830, ack 2075, win 156, options [nop,nop,TS val 1261898977 ecr 423702083], length 1448
00:00:01.283056 IP client > youtube: Flags [.], ack 68830, win 33304, options [nop,nop,TS val 423702085 ecr 1261898977], length 0
00:00:01.404961 IP youtube > client: Flags [.], seq 68830:70278, ack 2075, win 156, options [nop,nop,TS val 1261899096 ecr 423702085], length 1448
00:00:01.405802 IP youtube > client: Flags [.], seq 70278:71726, ack 2075, win 156, options [nop,nop,TS val 1261899096 ecr 423702085], length 1448
00:00:01.405987 IP client > youtube: Flags [.], ack 71726, win 33304, options [nop,nop,TS val 423702086 ecr 1261899096], length 0
00:00:01.406198 IP youtube > client: Flags [.], seq 71726:73174, ack 2075, win 156, options [nop,nop,TS val 1261899096 ecr 423702085], length 1448
00:00:01.406805 IP youtube > client: Flags [.], seq 73174:74622, ack 2075, win 156, options [nop,nop,TS val 1261899096 ecr 423702085], length 1448
00:00:01.406824 IP client > youtube: Flags [.], ack 74622, win 32580, options [nop,nop,TS val 423702086 ecr 1261899096], length 0
00:00:01.407162 IP youtube > client: Flags [.], seq 74622:76070, ack 2075, win 156, options [nop,nop,TS val 1261899101 ecr 423702085], length 1448
00:00:01.407187 IP client > youtube: Flags [.], ack 76070, win 33304, options [nop,nop,TS val 423702086 ecr 1261899101], length 0
00:00:01.407806 IP youtube > client: Flags [.], seq 76070:77518, ack 2075, win 156, options [nop,nop,TS val 1261899101 ecr 423702085], length 1448
00:00:01.408196 IP youtube > client: Flags [.], seq 77518:78966, ack 2075, win 156, options [nop,nop,TS val 1261899101 ecr 423702085], length 1448
00:00:01.408221 IP client > youtube: Flags [.], ack 78966, win 33304, options [nop,nop,TS val 423702086 ecr 1261899101], length 0
00:00:01.408543 IP youtube > client: Flags [.], seq 78966:80414, ack 2075, win 156, options [nop,nop,TS val 1261899101 ecr 423702085], length 1448
00:00:01.409052 IP youtube > client: Flags [.], seq 80414:81862, ack 2075, win 156, options [nop,nop,TS val 1261899101 ecr 423702085], length 1448
00:00:01.409079 IP client > youtube: Flags [.], ack 81862, win 33304, options [nop,nop,TS val 423702086 ecr 1261899101], length 0
00:00:01.409587 IP youtube > client: Flags [.], seq 81862:83310, ack 2075, win 156, options [nop,nop,TS val 1261899101 ecr 423702085], length 1448
00:00:01.410454 IP youtube > client: Flags [.], seq 83310:84758, ack 2075, win 156, options [nop,nop,TS val 1261899104 ecr 423702085], length 1448
00:00:01.410535 IP client > youtube: Flags [.], ack 84758, win 33304, options [nop,nop,TS val 423702086 ecr 1261899101], length 0
00:00:01.410731 IP youtube > client: Flags [.], seq 84758:86206, ack 2075, win 156, options [nop,nop,TS val 1261899104 ecr 423702085], length 1448
00:00:01.411237 IP youtube > client: Flags [.], seq 86206:87654, ack 2075, win 156, options [nop,nop,TS val 1261899104 ecr 423702085], length 1448
00:00:01.411251 IP client > youtube: Flags [.], ack 87654, win 32580, options [nop,nop,TS val 423702086 ecr 1261899104], length 0
00:00:01.411792 IP youtube > client: Flags [.], seq 87654:89102, ack 2075, win 156, options [nop,nop,TS val 1261899104 ecr 423702085], length 1448
00:00:01.411824 IP client > youtube: Flags [.], ack 89102, win 33304, options [nop,nop,TS val 423702086 ecr 1261899104], length 0
00:00:01.412938 IP youtube > client: Flags [.], seq 89102:90550, ack 2075, win 156, options [nop,nop,TS val 1261899104 ecr 423702085], length 1448
00:00:01.413337 IP youtube > client: Flags [.], seq 90550:91998, ack 2075, win 156, options [nop,nop,TS val 1261899104 ecr 423702085], length 1448
00:00:01.413374 IP client > youtube: Flags [.], ack 91998, win 33304, options [nop,nop,TS val 423702086 ecr 1261899104], length 0
00:00:01.413693 IP youtube > client: Flags [.], seq 91998:93446, ack 2075, win 156, options [nop,nop,TS val 1261899104 ecr 423702085], length 1448
00:00:01.414307 IP youtube > client: Flags [.], seq 93446:94894, ack 2075, win 156, options [nop,nop,TS val 1261899104 ecr 423702085], length 1448
00:00:01.414372 IP client > youtube: Flags [.], ack 94894, win 33304, options [nop,nop,TS val 423702086 ecr 1261899104], length 0
00:00:01.414573 IP youtube > client: Flags [.], seq 94894:96342, ack 2075, win 156, options [nop,nop,TS val 1261899104 ecr 423702085], length 1448
00:00:01.415082 IP youtube > client: Flags [P.], seq 96342:97790, ack 2075, win 156, options [nop,nop,TS val 1261899104 ecr 423702085], length 1448
00:00:01.415099 IP client > youtube: Flags [.], ack 97790, win 32580, options [nop,nop,TS val 423702086 ecr 1261899104], length 0
00:00:01.415400 IP youtube > client: Flags [.], seq 97790:99238, ack 2075, win 156, options [nop,nop,TS val 1261899104 ecr 423702085], length 1448
00:00:01.415425 IP client > youtube: Flags [.], ack 99238, win 33304, options [nop,nop,TS val 423702086 ecr 1261899104], length 0
00:00:01.420120 IP youtube > client: Flags [.], seq 99238:100686, ack 2075, win 156, options [nop,nop,TS val 1261899115 ecr 423702085], length 1448
00:00:01.420250 IP youtube > client: Flags [.], seq 100686:102134, ack 2075, win 156, options [nop,nop,TS val 1261899115 ecr 423702085], length 1448
00:00:01.420284 IP client > youtube: Flags [.], ack 102134, win 33304, options [nop,nop,TS val 423702086 ecr 1261899115], length 0
00:00:01.420584 IP youtube > client: Flags [.], seq 102134:103582, ack 2075, win 156, options [nop,nop,TS val 1261899115 ecr 423702085], length 1448
00:00:01.425944 IP youtube > client: Flags [.], seq 103582:105030, ack 2075, win 156, options [nop,nop,TS val 1261899118 ecr 423702085], length 1448
00:00:01.426068 IP client > youtube: Flags [.], ack 105030, win 33304, options [nop,nop,TS val 423702087 ecr 1261899115], length 0
00:00:01.426218 IP youtube > client: Flags [.], seq 105030:106478, ack 2075, win 156, options [nop,nop,TS val 1261899118 ecr 423702085], length 1448
00:00:01.426541 IP youtube > client: Flags [.], seq 106478:107926, ack 2075, win 156, options [nop,nop,TS val 1261899118 ecr 423702085], length 1448
00:00:01.426578 IP client > youtube: Flags [.], ack 107926, win 33304, options [nop,nop,TS val 423702087 ecr 1261899118], length 0
00:00:01.427558 IP youtube > client: Flags [.], seq 107926:109374, ack 2075, win 156, options [nop,nop,TS val 1261899118 ecr 423702085], length 1448
00:00:01.427991 IP youtube > client: Flags [.], seq 109374:110822, ack 2075, win 156, options [nop,nop,TS val 1261899118 ecr 423702085], length 1448
00:00:01.428007 IP client > youtube: Flags [.], ack 110822, win 32580, options [nop,nop,TS val 423702087 ecr 1261899118], length 0
00:00:01.428557 IP youtube > client: Flags [.], seq 110822:112270, ack 2075, win 156, options [nop,nop,TS val 1261899118 ecr 423702085], length 1448
00:00:01.428583 IP client > youtube: Flags [.], ack 112270, win 33304, options [nop,nop,TS val 423702087 ecr 1261899118], length 0
00:00:01.428851 IP youtube > client: Flags [.], seq 112270:113718, ack 2075, win 156, options [nop,nop,TS val 1261899118 ecr 423702085], length 1448
00:00:01.429334 IP youtube > client: Flags [.], seq 113718:115166, ack 2075, win 156, options [nop,nop,TS val 1261899118 ecr 423702085], length 1448
00:00:01.429365 IP client > youtube: Flags [.], ack 115166, win 33304, options [nop,nop,TS val 423702087 ecr 1261899118], length 0
00:00:01.429920 IP youtube > client: Flags [.], seq 115166:116614, ack 2075, win 156, options [nop,nop,TS val 1261899118 ecr 423702085], length 1448
00:00:01.452174 IP youtube > client: Flags [.], seq 116614:118062, ack 2075, win 156, options [nop,nop,TS val 1261899146 ecr 423702085], length 1448
00:00:01.452369 IP youtube > client: Flags [.], seq 118062:119510, ack 2075, win 156, options [nop,nop,TS val 1261899146 ecr 423702085], length 1448
00:00:01.452494 IP client > youtube: Flags [.], ack 119510, win 33304, options [nop,nop,TS val 423702087 ecr 1261899118], length 0
00:00:01.452754 IP youtube > client: Flags [.], seq 119510:120958, ack 2075, win 156, options [nop,nop,TS val 1261899146 ecr 423702085], length 1448
00:00:01.520690 IP client > youtube: Flags [.], ack 120958, win 33304, options [nop,nop,TS val 423702087 ecr 1261899146], length 0
00:00:01.568324 IP youtube > client: Flags [.], seq 120958:122406, ack 2075, win 156, options [nop,nop,TS val 1261899263 ecr 423702086], length 1448
00:00:01.568579 IP youtube > client: Flags [.], seq 122406:123854, ack 2075, win 156, options [nop,nop,TS val 1261899263 ecr 423702086], length 1448
00:00:01.568615 IP client > youtube: Flags [.], ack 123854, win 33304, options [nop,nop,TS val 423702088 ecr 1261899263], length 0
00:00:01.569319 IP youtube > client: Flags [.], seq 123854:125302, ack 2075, win 156, options [nop,nop,TS val 1261899263 ecr 423702086], length 1448
00:00:01.572300 IP youtube > client: Flags [.], seq 125302:126750, ack 2075, win 156, options [nop,nop,TS val 1261899267 ecr 423702086], length 1448
00:00:01.572372 IP client > youtube: Flags [.], ack 126750, win 33304, options [nop,nop,TS val 423702088 ecr 1261899263], length 0
00:00:01.572593 IP youtube > client: Flags [.], seq 126750:128198, ack 2075, win 156, options [nop,nop,TS val 1261899267 ecr 423702086], length 1448
00:00:01.573101 IP youtube > client: Flags [P.], seq 128198:129646, ack 2075, win 156, options [nop,nop,TS val 1261899267 ecr 423702086], length 1448
00:00:01.573121 IP client > youtube: Flags [.], ack 129646, win 32580, options [nop,nop,TS val 423702088 ecr 1261899267], length 0
00:00:01.573506 IP youtube > client: Flags [.], seq 129646:131094, ack 2075, win 156, options [nop,nop,TS val 1261899267 ecr 423702086], length 1448
00:00:01.573540 IP client > youtube: Flags [.], ack 131094, win 33304, options [nop,nop,TS val 423702088 ecr 1261899267], length 0
00:00:01.574283 IP youtube > client: Flags [.], seq 131094:132542, ack 2075, win 156, options [nop,nop,TS val 1261899267 ecr 423702086], length 1448
00:00:01.574703 IP youtube > client: Flags [.], seq 132542:133990, ack 2075, win 156, options [nop,nop,TS val 1261899267 ecr 423702086], length 1448
00:00:01.574730 IP client > youtube: Flags [.], ack 133990, win 33304, options [nop,nop,TS val 423702088 ecr 1261899267], length 0
00:00:01.575022 IP youtube > client: Flags [.], seq 133990:135438, ack 2075, win 156, options [nop,nop,TS val 1261899267 ecr 423702086], length 1448
00:00:01.575582 IP youtube > client: Flags [.], seq 135438:136886, ack 2075, win 156, options [nop,nop,TS val 1261899267 ecr 423702086], length 1448
00:00:01.575611 IP client > youtube: Flags [.], ack 136886, win 33304, options [nop,nop,TS val 423702088 ecr 1261899267], length 0
00:00:01.576392 IP youtube > client: Flags [.], seq 136886:138334, ack 2075, win 156, options [nop,nop,TS val 1261899271 ecr 423702086], length 1448
00:00:01.576804 IP youtube > client: Flags [.], seq 138334:139782, ack 2075, win 156, options [nop,nop,TS val 1261899271 ecr 423702086], length 1448
00:00:01.576842 IP client > youtube: Flags [.], ack 139782, win 33304, options [nop,nop,TS val 423702088 ecr 1261899271], length 0
00:00:01.577147 IP youtube > client: Flags [.], seq 139782:141230, ack 2075, win 156, options [nop,nop,TS val 1261899271 ecr 423702086], length 1448
00:00:01.577603 IP youtube > client: Flags [.], seq 141230:142678, ack 2075, win 156, options [nop,nop,TS val 1261899271 ecr 423702086], length 1448
00:00:01.577617 IP client > youtube: Flags [.], ack 142678, win 32580, options [nop,nop,TS val 423702088 ecr 1261899271], length 0
00:00:01.578193 IP youtube > client: Flags [.], seq 142678:144126, ack 2075, win 156, options [nop,nop,TS val 1261899271 ecr 423702086], length 1448
00:00:01.578225 IP client > youtube: Flags [.], ack 144126, win 33304, options [nop,nop,TS val 423702088 ecr 1261899271], length 0
00:00:01.578766 IP youtube > client: Flags [.], seq 144126:145574, ack 2075, win 156, options [nop,nop,TS val 1261899271 ecr 423702086], length 1448
00:00:01.580175 IP youtube > client: Flags [.], seq 145574:147022, ack 2075, win 156, options [nop,nop,TS val 1261899275 ecr 423702086], length 1448
00:00:01.580237 IP client > youtube: Flags [.], ack 147022, win 33304, options [nop,nop,TS val 423702088 ecr 1261899271], length 0
00:00:01.581299 IP youtube > client: Flags [.], seq 147022:148470, ack 2075, win 156, options [nop,nop,TS val 1261899275 ecr 423702086], length 1448
00:00:01.581692 IP youtube > client: Flags [.], seq 148470:149918, ack 2075, win 156, options [nop,nop,TS val 1261899275 ecr 423702086], length 1448
00:00:01.581726 IP client > youtube: Flags [.], ack 149918, win 33304, options [nop,nop,TS val 423702088 ecr 1261899275], length 0
00:00:01.582235 IP youtube > client: Flags [.], seq 149918:151366, ack 2075, win 156, options [nop,nop,TS val 1261899275 ecr 423702086], length 1448
00:00:01.582649 IP youtube > client: Flags [.], seq 151366:152814, ack 2075, win 156, options [nop,nop,TS val 1261899275 ecr 423702086], length 1448
00:00:01.582681 IP client > youtube: Flags [.], ack 152814, win 33304, options [nop,nop,TS val 423702088 ecr 1261899275], length 0
00:00:01.583201 IP youtube > client: Flags [.], seq 152814:154262, ack 2075, win 156, options [nop,nop,TS val 1261899275 ecr 423702086], length 1448
00:00:01.583669 IP youtube > client: Flags [.], seq 154262:155710, ack 2075, win 156, options [nop,nop,TS val 1261899275 ecr 423702086], length 1448
00:00:01.583695 IP client > youtube: Flags [.], ack 155710, win 32580, options [nop,nop,TS val 423702088 ecr 1261899275], length 0
00:00:01.584204 IP youtube > client: Flags [.], seq 155710:157158, ack 2075, win 156, options [nop,nop,TS val 1261899275 ecr 423702086], length 1448
00:00:01.584623 IP youtube > client: Flags [.], seq 157158:158606, ack 2075, win 156, options [nop,nop,TS val 1261899279 ecr 423702086], length 1448
00:00:01.585017 IP youtube > client: Flags [.], seq 158606:160054, ack 2075, win 156, options [nop,nop,TS val 1261899279 ecr 423702086], length 1448
00:00:01.585368 IP youtube > client: Flags [P.], seq 160054:161502, ack 2075, win 156, options [nop,nop,TS val 1261899279 ecr 423702086], length 1448
00:00:01.585386 IP client > youtube: Flags [.], ack 161502, win 29684, options [nop,nop,TS val 423702088 ecr 1261899275], length 0
00:00:01.588318 IP youtube > client: Flags [.], seq 161502:162950, ack 2075, win 156, options [nop,nop,TS val 1261899283 ecr 423702087], length 1448
00:00:01.588377 IP client > youtube: Flags [.], ack 162950, win 33056, options [nop,nop,TS val 423702088 ecr 1261899283], length 0
00:00:01.588627 IP youtube > client: Flags [.], seq 162950:164398, ack 2075, win 156, options [nop,nop,TS val 1261899283 ecr 423702087], length 1448
00:00:01.589133 IP youtube > client: Flags [.], seq 164398:165846, ack 2075, win 156, options [nop,nop,TS val 1261899283 ecr 423702087], length 1448
00:00:01.589183 IP client > youtube: Flags [.], ack 165846, win 33304, options [nop,nop,TS val 423702088 ecr 1261899283], length 0
00:00:01.589487 IP youtube > client: Flags [.], seq 165846:167294, ack 2075, win 156, options [nop,nop,TS val 1261899283 ecr 423702087], length 1448
00:00:01.590060 IP youtube > client: Flags [.], seq 167294:168742, ack 2075, win 156, options [nop,nop,TS val 1261899283 ecr 423702087], length 1448
00:00:01.590092 IP client > youtube: Flags [.], ack 168742, win 33304, options [nop,nop,TS val 423702088 ecr 1261899283], length 0
00:00:01.592331 IP youtube > client: Flags [.], seq 168742:170190, ack 2075, win 156, options [nop,nop,TS val 1261899287 ecr 423702087], length 1448
00:00:01.593092 IP youtube > client: Flags [.], seq 170190:171638, ack 2075, win 156, options [nop,nop,TS val 1261899287 ecr 423702087], length 1448
00:00:01.593142 IP client > youtube: Flags [.], ack 171638, win 33304, options [nop,nop,TS val 423702088 ecr 1261899287], length 0
00:00:01.593393 IP youtube > client: Flags [.], seq 171638:173086, ack 2075, win 156, options [nop,nop,TS val 1261899287 ecr 423702087], length 1448
00:00:01.593916 IP youtube > client: Flags [.], seq 173086:174534, ack 2075, win 156, options [nop,nop,TS val 1261899287 ecr 423702087], length 1448
00:00:01.593928 IP client > youtube: Flags [.], ack 174534, win 32580, options [nop,nop,TS val 423702088 ecr 1261899287], length 0
00:00:01.594487 IP youtube > client: Flags [.], seq 174534:175982, ack 2075, win 156, options [nop,nop,TS val 1261899287 ecr 423702087], length 1448
00:00:01.594520 IP client > youtube: Flags [.], ack 175982, win 33304, options [nop,nop,TS val 423702088 ecr 1261899287], length 0
00:00:01.595025 IP youtube > client: Flags [.], seq 175982:177430, ack 2075, win 156, options [nop,nop,TS val 1261899287 ecr 423702087], length 1448
00:00:01.614725 IP youtube > client: Flags [.], seq 177430:178878, ack 2075, win 156, options [nop,nop,TS val 1261899309 ecr 423702087], length 1448
00:00:01.614965 IP client > youtube: Flags [.], ack 178878, win 33304, options [nop,nop,TS val 423702088 ecr 1261899287], length 0
00:00:01.615060 IP youtube > client: Flags [.], seq 178878:180326, ack 2075, win 156, options [nop,nop,TS val 1261899309 ecr 423702087], length 1448
00:00:01.615381 IP youtube > client: Flags [.], seq 180326:181774, ack 2075, win 156, options [nop,nop,TS val 1261899309 ecr 423702087], length 1448
00:00:01.615423 IP client > youtube: Flags [.], ack 181774, win 33304, options [nop,nop,TS val 423702088 ecr 1261899309], length 0
00:00:01.615998 IP youtube > client: Flags [.], seq 181774:183222, ack 2075, win 156, options [nop,nop,TS val 1261899309 ecr 423702087], length 1448
00:00:01.685157 IP youtube > client: Flags [.], seq 183222:184670, ack 2075, win 156, options [nop,nop,TS val 1261899378 ecr 423702087], length 1448
00:00:01.685162 IP youtube > client: Flags [.], seq 184670:186118, ack 2075, win 156, options [nop,nop,TS val 1261899378 ecr 423702087], length 1448
00:00:01.685308 IP client > youtube: Flags [.], ack 186118, win 33056, options [nop,nop,TS val 423702089 ecr 1261899309], length 0
00:00:01.729909 IP youtube > client: Flags [.], seq 186118:187566, ack 2075, win 156, options [nop,nop,TS val 1261899424 ecr 423702088], length 1448
00:00:01.729965 IP client > youtube: Flags [.], ack 187566, win 32580, options [nop,nop,TS val 423702090 ecr 1261899424], length 0
00:00:01.731616 IP youtube > client: Flags [.], seq 187566:189014, ack 2075, win 156, options [nop,nop,TS val 1261899424 ecr 423702088], length 1448
00:00:01.731670 IP client > youtube: Flags [.], ack 189014, win 33304, options [nop,nop,TS val 423702090 ecr 1261899424], length 0
00:00:01.733074 IP youtube > client: Flags [.], seq 189014:190462, ack 2075, win 156, options [nop,nop,TS val 1261899424 ecr 423702088], length 1448
00:00:01.733105 IP client > youtube: Flags [.], ack 190462, win 32580, options [nop,nop,TS val 423702090 ecr 1261899424], length 0
00:00:01.734552 IP youtube > client: Flags [.], seq 190462:191910, ack 2075, win 156, options [nop,nop,TS val 1261899428 ecr 423702088], length 1448
00:00:01.734586 IP client > youtube: Flags [.], ack 191910, win 33304, options [nop,nop,TS val 423702090 ecr 1261899428], length 0
00:00:01.735097 IP youtube > client: Flags [.], seq 191910:193358, ack 2075, win 156, options [nop,nop,TS val 1261899428 ecr 423702088], length 1448
00:00:01.735110 IP client > youtube: Flags [.], ack 193358, win 32580, options [nop,nop,TS val 423702090 ecr 1261899428], length 0
00:00:01.738278 IP youtube > client: Flags [P.], seq 193358:194806, ack 2075, win 156, options [nop,nop,TS val 1261899432 ecr 423702088], length 1448
00:00:01.738335 IP client > youtube: Flags [.], ack 194806, win 32580, options [nop,nop,TS val 423702090 ecr 1261899432], length 0
00:00:01.742738 IP youtube > client: Flags [.], seq 194806:196254, ack 2075, win 156, options [nop,nop,TS val 1261899436 ecr 423702088], length 1448
00:00:01.742744 IP youtube > client: Flags [.], seq 196254:197702, ack 2075, win 156, options [nop,nop,TS val 1261899436 ecr 423702088], length 1448
00:00:01.742746 IP youtube > client: Flags [.], seq 197702:199150, ack 2075, win 156, options [nop,nop,TS val 1261899436 ecr 423702088], length 1448
00:00:01.742835 IP client > youtube: Flags [.], ack 199150, win 32684, options [nop,nop,TS val 423702090 ecr 1261899436], length 0
00:00:01.743035 IP youtube > client: Flags [.], seq 199150:200598, ack 2075, win 156, options [nop,nop,TS val 1261899436 ecr 423702088], length 1448
00:00:01.743589 IP youtube > client: Flags [.], seq 200598:202046, ack 2075, win 156, options [nop,nop,TS val 1261899436 ecr 423702088], length 1448
00:00:01.743614 IP client > youtube: Flags [.], ack 202046, win 33284, options [nop,nop,TS val 423702090 ecr 1261899436], length 0
00:00:01.744173 IP youtube > client: Flags [.], seq 202046:203494, ack 2075, win 156, options [nop,nop,TS val 1261899436 ecr 423702088], length 1448
00:00:01.746097 IP youtube > client: Flags [.], seq 203494:204942, ack 2075, win 156, options [nop,nop,TS val 1261899436 ecr 423702088], length 1448
00:00:01.746190 IP client > youtube: Flags [.], ack 204942, win 33304, options [nop,nop,TS val 423702090 ecr 1261899436], length 0
00:00:01.747998 IP youtube > client: Flags [.], seq 204942:206390, ack 2075, win 156, options [nop,nop,TS val 1261899436 ecr 423702088], length 1448
00:00:01.748561 IP youtube > client: Flags [.], seq 206390:207838, ack 2075, win 156, options [nop,nop,TS val 1261899436 ecr 423702088], length 1448
00:00:01.748589 IP client > youtube: Flags [.], ack 207838, win 32580, options [nop,nop,TS val 423702090 ecr 1261899436], length 0
00:00:01.748790 IP youtube > client: Flags [.], seq 207838:209286, ack 2075, win 156, options [nop,nop,TS val 1261899436 ecr 423702088], length 1448
00:00:01.748822 IP client > youtube: Flags [.], ack 209286, win 33304, options [nop,nop,TS val 423702090 ecr 1261899436], length 0
00:00:01.749210 IP youtube > client: Flags [.], seq 209286:210734, ack 2075, win 156, options [nop,nop,TS val 1261899436 ecr 423702088], length 1448
00:00:01.749834 IP youtube > client: Flags [.], seq 210734:212182, ack 2075, win 156, options [nop,nop,TS val 1261899440 ecr 423702088], length 1448
00:00:01.749866 IP client > youtube: Flags [.], ack 212182, win 33304, options [nop,nop,TS val 423702090 ecr 1261899436], length 0
00:00:01.750193 IP youtube > client: Flags [.], seq 212182:213630, ack 2075, win 156, options [nop,nop,TS val 1261899440 ecr 423702088], length 1448
00:00:01.750738 IP youtube > client: Flags [.], seq 213630:215078, ack 2075, win 156, options [nop,nop,TS val 1261899440 ecr 423702088], length 1448
00:00:01.750781 IP client > youtube: Flags [.], ack 215078, win 33304, options [nop,nop,TS val 423702090 ecr 1261899440], length 0
00:00:01.751075 IP youtube > client: Flags [.], seq 215078:216526, ack 2075, win 156, options [nop,nop,TS val 1261899440 ecr 423702088], length 1448
00:00:01.751645 IP youtube > client: Flags [.], seq 216526:217974, ack 2075, win 156, options [nop,nop,TS val 1261899444 ecr 423702088], length 1448
00:00:01.751681 IP client > youtube: Flags [.], ack 217974, win 33304, options [nop,nop,TS val 423702090 ecr 1261899440], length 0
00:00:01.751981 IP youtube > client: Flags [.], seq 217974:219422, ack 2075, win 156, options [nop,nop,TS val 1261899444 ecr 423702088], length 1448
00:00:01.752570 IP youtube > client: Flags [.], seq 219422:220870, ack 2075, win 156, options [nop,nop,TS val 1261899444 ecr 423702088], length 1448
00:00:01.752596 IP client > youtube: Flags [.], ack 220870, win 32580, options [nop,nop,TS val 423702090 ecr 1261899444], length 0
00:00:01.753957 IP youtube > client: Flags [.], seq 220870:222318, ack 2075, win 156, options [nop,nop,TS val 1261899448 ecr 423702088], length 1448
00:00:01.754400 IP youtube > client: Flags [.], seq 222318:223766, ack 2075, win 156, options [nop,nop,TS val 1261899448 ecr 423702088], length 1448
00:00:01.754794 IP client > youtube: Flags [.], ack 223766, win 32932, options [nop,nop,TS val 423702090 ecr 1261899448], length 0
00:00:01.754841 IP youtube > client: Flags [.], seq 223766:225214, ack 2075, win 156, options [nop,nop,TS val 1261899448 ecr 423702088], length 1448
00:00:01.755418 IP youtube > client: Flags [.], seq 225214:226662, ack 2075, win 156, options [nop,nop,TS val 1261899448 ecr 423702088], length 1448
00:00:01.755454 IP client > youtube: Flags [.], ack 226662, win 33304, options [nop,nop,TS val 423702090 ecr 1261899448], length 0
00:00:01.755791 IP youtube > client: Flags [.], seq 226662:228110, ack 2075, win 156, options [nop,nop,TS val 1261899448 ecr 423702088], length 1448
00:00:01.756354 IP youtube > client: Flags [P.], seq 228110:229558, ack 2075, win 156, options [nop,nop,TS val 1261899448 ecr 423702088], length 1448
00:00:01.756379 IP client > youtube: Flags [.], ack 229558, win 32580, options [nop,nop,TS val 423702090 ecr 1261899448], length 0
00:00:01.756740 IP youtube > client: Flags [.], seq 229558:231006, ack 2075, win 156, options [nop,nop,TS val 1261899448 ecr 423702088], length 1448
00:00:01.756787 IP client > youtube: Flags [.], ack 231006, win 33304, options [nop,nop,TS val 423702090 ecr 1261899448], length 0
00:00:01.757430 IP youtube > client: Flags [.], seq 231006:232454, ack 2075, win 156, options [nop,nop,TS val 1261899448 ecr 423702088], length 1448
00:00:01.757818 IP youtube > client: Flags [.], seq 232454:233902, ack 2075, win 156, options [nop,nop,TS val 1261899448 ecr 423702088], length 1448
00:00:01.757850 IP client > youtube: Flags [.], ack 233902, win 33304, options [nop,nop,TS val 423702090 ecr 1261899448], length 0
00:00:01.758176 IP youtube > client: Flags [.], seq 233902:235350, ack 2075, win 156, options [nop,nop,TS val 1261899448 ecr 423702088], length 1448
00:00:01.759113 IP youtube > client: Flags [P.], seq 235350:236798, ack 2075, win 156, options [nop,nop,TS val 1261899452 ecr 423702088], length 1448
00:00:01.759131 IP client > youtube: Flags [.], ack 236798, win 32580, options [nop,nop,TS val 423702090 ecr 1261899448], length 0
00:00:01.759669 IP youtube > client: Flags [.], seq 236798:238246, ack 2075, win 156, options [nop,nop,TS val 1261899452 ecr 423702088], length 1448
00:00:01.759715 IP client > youtube: Flags [.], ack 238246, win 33304, options [nop,nop,TS val 423702090 ecr 1261899452], length 0
00:00:01.760086 IP youtube > client: Flags [.], seq 238246:239694, ack 2075, win 156, options [nop,nop,TS val 1261899452 ecr 423702088], length 1448
00:00:01.761091 IP youtube > client: Flags [.], seq 239694:241142, ack 2075, win 156, options [nop,nop,TS val 1261899452 ecr 423702088], length 1448
00:00:01.761114 IP client > youtube: Flags [.], ack 241142, win 33304, options [nop,nop,TS val 423702090 ecr 1261899452], length 0
00:00:01.761470 IP youtube > client: Flags [.], seq 241142:242590, ack 2075, win 156, options [nop,nop,TS val 1261899452 ecr 423702088], length 1448
00:00:01.778164 IP youtube > client: Flags [.], seq 242590:244038, ack 2075, win 156, options [nop,nop,TS val 1261899472 ecr 423702088], length 1448
00:00:01.778247 IP client > youtube: Flags [.], ack 244038, win 33304, options [nop,nop,TS val 423702090 ecr 1261899452], length 0
